title,subreddit,word_count,char_count,neg_sen,pos_sen
who has turmeric drink recipes on the cheap,0,8,43,0.0,0.0
best instant pot recipes,0,4,24,0.0,0.583
kitchenware,0,1,11,0.0,0.0
meal delivery services to beat the takeout habit,0,8,48,0.0,0.0
what do you like to make with fresh blueberries,0,9,47,0.0,0.407
suggestions for recipes to use some of my bumper mint crop,0,11,58,0.0,0.0
roasted apples ,0,2,15,0.0,0.0
eating cheap healthy and without my stomach wanting to die while doing it,0,13,73,0.222,0.153
sunday 'storecupboard' recipe ideas,0,4,35,0.0,0.0
i didnt realize how easy cheap and versatile crepes are until i made them at home,0,16,81,0.156,0.0
food keeps rotting in my fridge help,0,7,36,0.0,0.31
in light of the intense summertime heat let's talk the perfect refreshing super healthy summertime beverage,0,16,107,0.0,0.492
muscle peasfavorite seasonings,0,3,30,0.0,0.0
update you guys have saved us so much money,0,9,43,0.0,0.259
what is your favorite chili recipe and what is it that makes it so great,0,15,72,0.0,0.388
microwave oatmeals coming out tasting worse than stovetop,0,8,57,0.307,0.0
doing a completely meatless week,0,5,32,0.0,0.0
just eat popcorn fam,0,4,20,0.0,0.0
how to form healthy eating habits if i have these bad habits,0,12,60,0.23,0.178
my ovenhob combo is broken and i have to rely on the slow cooker,0,14,64,0.205,0.0
 month work trip,0,3,16,0.0,0.0
suggestions for people who hate cooking and grocery shopping,0,9,60,0.316,0.0
how to meal prep dried large amount of dried beans to save money over purchasing canned beans,0,17,93,0.0,0.167
how to freeze and reheat meals i know it sounds dumb lol,0,12,56,0.216,0.261
amazon prime day deals   qt instant pot for  bucks now what,0,11,59,0.0,0.333
how do you like to have your protein shake,0,9,42,0.152,0.223
college cook books,0,3,18,0.0,0.0
can anyone recommend a peanut butter similar to skippy or jif with no added sugar,0,15,81,0.132,0.15
my results experimenting with seitan,0,5,36,0.0,0.0
porridge,0,1,8,0.0,0.0
bought  lbs of organic baby bella mushrooms for  each,0,9,53,0.0,0.0
long hours snacks,0,3,17,0.0,0.0
ive been having three eggs and a potato for breakfast every morning this week very filling and delicious for under ,0,20,115,0.0,0.18
chicken stumped,0,2,15,0.0,0.0
protein pancakes,0,2,16,0.0,0.0
i'm a traveling inventory associate and eat like crap,0,9,53,0.234,0.225
hiding the terrible tuna i bought in a dish,0,9,43,0.515,0.0
snack advice,0,2,12,0.0,0.0
after work snacks for carpenters,0,5,32,0.0,0.0
any other ways to cook greens other than the traditional southern greens style,0,13,78,0.0,0.0
college student looking for advice,0,5,34,0.0,0.0
best app for making meals,0,5,25,0.0,0.512
what simple and healthy recipes are good to learn for someone new to cooking,0,14,76,0.0,0.318
for meat eaters to save money think of meat as a side dish to your meal not the main entree,0,20,91,0.0,0.151
marinating pre cooked chicken,0,4,29,0.0,0.0
one pan balsamicgarlic chicken and sweet potatoapple bake     cals g protein,0,11,76,0.0,0.25
i have  and need to make it last between  people for two weeks any suggestions,0,15,78,0.0,0.0
what are some meals to eat without going bad if not refrigerated,0,12,64,0.0,0.206
how can two adults living together eat healthy on a budget of  per week,0,14,71,0.0,0.184
what are your favourite newinteresting vegetable recipes,0,7,56,0.0,0.0
how to eat cheaply with frequent low volume meals,0,9,49,0.208,0.0
what are your best recipes to cook from scratch,0,9,47,0.0,0.344
what foods are good for bringing to picnics but allow you to flex your cookingpreparation ability bonus if veg friendly,0,20,119,0.0,0.521
my new favorite breakfast egg white oatmeal with bluebs and nut butter everything from costco,0,15,93,0.0,0.176
bean burgers,0,2,12,0.0,0.0
what is an easy healthy lunchdinner recipe i can make at home without spending hours in the kitchen,0,18,99,0.0,0.272
lazy college southwest chicken bowls   per meal,0,7,47,0.294,0.0
going on a  hour bus ride looking for healthy food ideas for the road,0,14,69,0.0,0.184
eating on a stomach bug,0,5,23,0.0,0.0
i just inherited a vitamix how can i use it to save money on groceries,0,15,70,0.0,0.225
good mints,0,2,10,0.0,0.744
update on slow cookerinstapot,0,4,29,0.0,0.0
had no idea this sub existed here's a nutrient densitycost efficiency cheat sheet i've been working on for a few months,0,21,119,0.219,0.105
how long will cooked chicken stay in the fridge,0,9,47,0.0,0.0
high calorie breakfast options that arent eggs,0,7,46,0.0,0.0
college student and i just found out im  short for the next academic year how in the world do i cut my grocery costs,0,24,116,0.091,0.0
fridge  microwave meals emphasis on healthy,0,6,43,0.0,0.351
meal planning in a motel,0,5,24,0.0,0.0
summer crock pot recipes,0,4,24,0.0,0.0
any cucumber recipes that aren't pickles,0,6,40,0.0,0.0
healthy sweets,0,2,14,0.0,1.0
tips on how to grocery shop in a food desert,0,10,44,0.0,0.0
easy one potone pan meals,0,5,25,0.0,0.42
meals to build muscle mass,0,5,26,0.0,0.0
what can i use tempura mix for besides tempura,0,9,46,0.0,0.0
tenderize cheap steaks,0,3,22,0.0,0.355
any suggestions for different salads i can make for lunches,0,10,59,0.0,0.0
does anyone have any healthy recipes or recommendations for someone that only has access to a small toaster oven and a small slow cooker,0,24,136,0.0,0.114
using everything up week ,0,4,25,0.0,0.0
healthy calorie dense snacks,0,4,28,0.0,0.474
eating clean   what does this mean,0,6,34,0.0,0.351
progresso soup not filling enough throw an uncle bens rice mix in that puppy,0,14,76,0.0,0.0
update because you guys dont want me to feel fat and worthless my mealplan,0,14,74,0.256,0.0
looking for healthybeneficial teas that have little to no caffiene,0,10,66,0.171,0.116
what are your go to freezer friendly meals,0,8,42,0.0,0.314
wondering if somebody could rate my diet today is it healthy enough should i add anythingtake anything out,0,18,106,0.0,0.144
what is the best way to get rid of that lower belly fat that always seem to persist,0,18,83,0.098,0.188
healthy lunches i can prepare at work,0,7,37,0.0,0.351
yall have inspired me to get a slow cooker i would be cooking for just me any recommendations on brand and size this is all new to me so thanks in advance for your help,0,35,168,0.0,0.243
cheap healthy good tasting hot cocoa,0,6,36,0.0,0.583
just moved into an apt with my bf and need help healthily stocking our kitchen for cheap except he hates beans sweet potatoes and various cooked veggies,0,27,152,0.089,0.175
chicken problems,0,2,16,0.73,0.0
fridge hacks,0,2,12,0.0,0.0
should we change the title of the sub to just eat cheap,0,12,55,0.0,0.0
high protein low cal foods cheap,0,6,32,0.296,0.0
 veggie soup,0,2,12,0.0,0.0
mushroom and spinach sandwich,0,4,29,0.0,0.0
follow up after being decapitated from my progressouncle bens post went shopping today,0,13,86,0.0,0.0
minimal cooking  serving meals,0,4,30,0.0,0.0
cheese questions,0,2,16,0.0,0.0
just wanted to share how i create healthy cheap soul food,0,11,57,0.0,0.5
chia seeds straight down the hatch,0,6,34,0.0,0.275
 nutritious summer recipes to try for healthy summer diet,0,9,57,0.0,0.252
looking for a list of south asian substitutes to western ingredients in foods commonly suggested on this thread any suggestions,0,20,127,0.0,0.0
studying abroad in rome what can i get cheap and healthy at the local markets,0,15,77,0.0,0.172
why does freezing or cooking berries make them sour,0,9,51,0.149,0.0
what are some good utensilscooking containers for ecah,0,8,54,0.0,0.293
freezable recipe request,0,3,24,0.0,0.0
any variations on the taco not just looking for meat or tortilla substitutes,0,13,76,0.0,0.0
for people who make smoothies do smoothies taste better if you soak chia seeds overnight,0,15,88,0.0,0.172
is my chicken bad,0,4,17,0.538,0.0
recipes,0,1,7,0.0,0.0
is enriched macaroni product healthy,0,5,36,0.0,0.403
cold skilly soup thin gruel,0,5,27,0.0,0.0
something fancy,0,2,15,0.0,0.0
why does microwaveable rice not dry out like reheating rice,0,10,59,0.19,0.0
high calorieprotein meals i can eat in a place with no kitchen,0,12,62,0.196,0.0
student with restrictive preferences lol help,0,6,45,0.0,0.579
wow so i finally decided to make my own tomato sauce for spaghetti and i can really taste the difference,0,20,104,0.0,0.183
week budget what should i get,0,6,29,0.0,0.0
mealplans for sleeping problems suggestions,0,5,43,0.403,0.0
my cheap go to,0,4,14,0.0,0.0
 weeks eating lean,0,3,18,0.0,0.0
good substitute for avacado,0,4,27,0.0,0.492
chips amp salsa,0,3,15,0.0,0.0
hobo dinner recipe,0,3,18,0.0,0.0
are smoothies actually good for you,0,6,35,0.0,0.367
what are your favorite healthy dessert recipes that are also relatively inexpensive to make,0,14,91,0.0,0.322
how do you get yourself to enjoy salads,0,8,39,0.0,0.314
how do i prevent boiled chicken breast from smelling funny after putting it in the fridge,0,16,89,0.0,0.235
scared about bacteria on leafy greens and how to disinfect what works and what doesn't,0,15,86,0.172,0.0
what cheap and healthy items can i add to my instant ramen,0,12,58,0.0,0.213
anyone have a good chili recipe,0,6,31,0.0,0.42
family of   adultschildren looking for ways to eat better cheaply,0,10,65,0.0,0.244
is broccoli something not meant to be eaten for it's protein content but to fill you up and get some more fiber,0,22,111,0.0,0.0
can you freeze frozen veg that has been cooked,0,9,46,0.0,0.13
soft  liquid foods,0,3,18,0.0,0.0
meatless mondays share your meat free and vegetarian recipes here,0,10,65,0.0,0.407
need recipes that cook fast,0,5,27,0.0,0.0
what are some healthy foodsnackswhatever to have in your house ,0,10,63,0.0,0.231
half gallon of whole milk about to expire,0,8,41,0.0,0.0
taste like edamame,0,3,18,0.0,0.556
im fat and worthless please help me make a mealplan,0,10,51,0.209,0.36
the secret to making a good skillet burger,0,8,42,0.0,0.326
trouble with daily commute,0,4,26,0.474,0.0
an easy cheap lunch,0,4,19,0.0,0.492
what would you do with lavender thai curry seasoning,0,9,52,0.0,0.0
my husband and i spend close to k in food each month major lifestyle change coming up and we need help,0,21,102,0.0,0.13
can anyone recommend a protein powder thats not outrageously sweet,0,10,66,0.193,0.341
beauty and the beets,0,4,20,0.0,0.559
tropical storm  day dinner plan,0,5,31,0.0,0.0
any healthy ground beef recipes,0,5,31,0.0,0.403
quick and simple breakfast to take to work,0,8,42,0.0,0.0
ive moved into a temporary place with an incredibly tiny unreliable fridge and a microwave no kitchen no freezer what can i make to get by for a month with just this,0,32,165,0.145,0.0
ideas for office morning tea,0,5,28,0.0,0.0
i spend  to  dollars on smoothies every day after my workout,0,11,60,0.0,0.0
need help making a meal plan for a variable amount of physical activity,0,13,71,0.0,0.213
anyone from bristol uk,0,4,22,0.0,0.0
i need help,0,3,11,0.0,0.73
looking for help refining my diet,0,6,33,0.0,0.351
how to get started ecah,0,5,23,0.0,0.0
does anyone have a month meal plan they can share,0,10,49,0.0,0.216
baked lemon chicken pasta meal,0,5,30,0.0,0.0
the best money saving tip yet,0,6,29,0.0,0.457
shopping on a budget in chicago,0,6,31,0.0,0.0
we eat the same thing for dinner almost every night wife is getting bored of it,0,16,79,0.123,0.0
fruit freezing tips anyone,0,4,26,0.318,0.0
living in a hotel for the next  months need meal ideas using just a microwave,0,15,77,0.0,0.0
ground boar is my new favorite protein affordable sustainable and healthy i made a stewed chickpeas with ground boar that we absolutely loved   recipe included,0,25,159,0.0,0.331
frozen brussel sprouts,0,3,22,0.0,0.0
meatless mondays share your meat free and vegetarian recipes here,0,10,65,0.0,0.407
do you know any tasty low calorie fruit andor veg smoothies,0,11,59,0.174,0.0
i just thought i'd share this cheap easy lentil ball recipe i tried and enjoyed,0,15,79,0.0,0.457
yummy vegetable recipes,0,3,23,0.0,0.63
professional painter on new construction sites a lot which limits me to cold lunches i'm sick of sandwiches and wraps i need some fresh ideas to spice up my lunchbox help,0,31,170,0.096,0.146
oats,0,1,4,0.0,0.0
healthy ingredients to spice up salad,0,6,37,0.0,0.351
easy and cheap pancake recipe,0,5,29,0.0,0.42
jack in the box not cheap or healthy,0,8,36,0.244,0.0
how to add flavor to cabbage rolls,0,7,34,0.0,0.0
soft diet food ideas,0,4,20,0.0,0.0
what to stock up on while doing a kitchen remodel,0,10,49,0.0,0.0
yummy vegetables and pasta,0,4,26,0.0,0.531
any tips for those of us who dont eat meals,0,10,43,0.0,0.0
how do i season black beans,0,6,27,0.0,0.0
what foods provide the most nutritional bang for their buck,0,10,59,0.0,0.0
pasta salads found in delis,0,5,27,0.0,0.0
healthy eating wout macro counting,0,5,34,0.0,0.403
looking for some meals that don't require the oven,0,9,50,0.0,0.0
vegetarianvegan grocery shopping on a student budget,0,7,52,0.0,0.0
anyone have some good super simple instant ramen broths,0,9,55,0.0,0.493
going veg   need fast filling meals,0,6,35,0.0,0.0
low on money this week until i get paid again,0,10,45,0.208,0.0
what are the recipes you keep going back to,0,9,43,0.0,0.0
share your favorite no stove recipes,0,6,36,0.212,0.5
first try at shakshuka,0,4,22,0.0,0.0
how do you like to eat cottage cheese,0,8,37,0.0,0.263
what is a good price for meat,0,7,29,0.0,0.367
how long once beans have been soaked,0,7,36,0.0,0.0
drinks for a mini fridge,0,5,24,0.0,0.0
healthyinexpensive snacks for breastfeeding mom,0,5,47,0.0,0.0
spinach bites,0,2,13,0.0,0.0
my anything goes fried rice i always make this when ingredients are getting low but i don't have time to get more,0,22,113,0.075,0.0
herbalife replacement,0,2,21,0.0,0.0
eggplants are on sale so i bought like  of them now what,0,12,56,0.0,0.217
poor man's pasta,0,3,16,0.608,0.0
bake your own bread for ,0,5,24,0.0,0.0
if you tell me what ingredients you have on hand ill try to write you a recipe,0,17,78,0.14,0.16
i had a mental breakdown yesterday and need to make changes in my life i have  minutes a night to cook whatre some healthy but easily prepared meals to get me started,0,32,166,0.0,0.226
iso high carb side dishes,0,5,25,0.0,0.0
healthy and light summer meals,0,5,30,0.0,0.403
what are your favorite cheap and healthy summer dishes including summer veggies,0,12,79,0.0,0.363
turnips and swiss chard,0,4,23,0.0,0.0
can you fry boneless and skinless chicken thighs in bacon grease,0,11,64,0.0,0.0
bodybuilding kcal diet  uni student meal ideas websites,0,8,55,0.0,0.0
how long can overnight oats that have been refrigerated stay outside of the fridge,0,14,82,0.0,0.0
in college with a limited budget,0,6,32,0.322,0.0
i have the weight of a small child's worth of rhubarb how do i use it without also consuming a ton of sugar,0,23,107,0.0,0.095
how do you beat the urge to eat dinner out,0,10,42,0.0,0.0
progresso light soups,0,3,21,0.0,0.0
my favorite post workout meal,0,5,29,0.0,0.429
meal replacement shakes,0,3,23,0.0,0.0
is crystal light a healthy alternative,0,6,38,0.0,0.403
vegetables are ok seasoning and sauting helps with taste but what are some good veggie meals or snacks you cant deny,0,21,116,0.0,0.366
im underweight my diet is terrible and my appetite is very low,0,12,62,0.355,0.0
sptzle with peas and mushrooms,0,5,30,0.0,0.0
boostensure liquid diet,0,3,23,0.0,0.0
can you completely substitute meat with eggs and sardines,0,9,57,0.0,0.0
i really want to start cooking my own meals but i live in university housing with only a microwave at my disposal any ideas should i buy a slow cooker,0,30,150,0.0,0.051
short term healthy shopping,0,4,27,0.0,0.474
pantry staples,0,2,14,0.0,0.0
can you reuse steamer water,0,5,27,0.0,0.0
i have been sober almost  days however i have gained lbs by switching an alcohol problem to a sugar and sweet problem any advice,0,24,128,0.193,0.2
suggestions for meals on a mostly liquid diet,0,8,45,0.0,0.0
breakfast replacing shake,0,3,25,0.459,0.0
suggestions for food or easy recipes with lots of protein but calories listed,0,13,77,0.0,0.14
i have loads cherries and i'm running out of ideas what should i make except jams,0,16,81,0.0,0.0
grilling for  people,0,3,20,0.0,0.0
cutting down on processed and junk foods,0,7,40,0.2,0.0
anyone know any apps to help find meals you can make with what you have,0,15,71,0.0,0.162
replicate einstein bros pizza bagel,0,5,35,0.0,0.0
i havent bought peanut butter in years,0,7,38,0.0,0.0
when y'all say 'beans and rice' what do you mean exactly best recipes,0,13,69,0.0,0.259
cheap meal ideas that are low carb low sugar low in fat low sodium and not so high in calories  max,0,21,99,0.331,0.0
do i under season everything,0,5,28,0.0,0.0
i have  lbs of lemons any recipes to go through them relatively quickly,0,13,71,0.0,0.0
 ingredient broccoli cheddar soup,0,4,33,0.0,0.0
i have a whole lot of black beans what can i do with them,0,14,57,0.0,0.0
meatless mondays share your meat free and vegetarian recipes here,0,10,65,0.0,0.407
android alternative to mealboard,0,4,32,0.0,0.0
i just bought a bunch of frozen berries for smoothies on vacation and there's no blender how can i use them,0,21,107,0.115,0.0
podcast episode about importance of meal planning health tips and fad diet discussions,0,13,86,0.0,0.286
been using myfitnesspal consistently for  months looking for suggestions,0,9,72,0.0,0.0
boiled potatoes with or without skin,0,6,36,0.0,0.0
best recipes for chicken breast  how to cook it without being dry,0,12,65,0.0,0.276
assuming i'm the most boring person ever who can eat the same meal every day what would you recommend to eat that's cheap and gives me good nutrition for a month,0,31,161,0.074,0.154
spending the next month in a residence inn for work any tips,0,12,60,0.0,0.0
are back pains common among young adults,0,7,40,0.318,0.0
has anyone come across an app that let you scan barcodes and help keep track of inventory of the things you have in the house,0,25,125,0.0,0.101
saurkraut,0,1,9,0.0,0.0
food that isnt bad for your teethnot full of fat not fish or meatnot bread and doesnt taste horrible,0,19,100,0.0,0.251
just got laid off how can i pinch pennies in the pantry and still have variety,0,16,78,0.0,0.0
low sugar dessert ideas,0,4,23,0.412,0.0
need help evaluating my current standard meal,0,7,45,0.0,0.31
meals with minimum ingredients,0,4,30,0.0,0.0
what do you like to prepare with your hardboiled eggs,0,10,53,0.0,0.217
good nutritious meals for an  year old living on his own for the first time,0,15,75,0.0,0.172
what's everyone budget on monthly making food at home and going out,0,12,67,0.0,0.0
i have a quick question about brining chicken,0,8,45,0.0,0.0
i could literally live off pizza however my wallet does not approve,0,12,67,0.0,0.0
instant noodlesramen question,0,3,29,0.0,0.0
what to do when you make too much to be on food stamps snap but too little to cover your regular expenses,0,22,105,0.0,0.0
veggie and chicken curry recipe   per serving,0,7,45,0.0,0.0
flexible main dish recipes for using up vegetables,0,8,50,0.0,0.213
cheap and healthy meal tips for a  year old while im at work,0,13,60,0.0,0.197
just moved to toronto from the us seeking recommendations on shopping,0,11,69,0.0,0.0
breakfast ideas that aren't oatmeal,0,5,35,0.0,0.0
question about sandwiches,0,3,25,0.0,0.0
has anyone found relatively cheap protein bars,0,7,46,0.0,0.0
are there any good healthy ways to drink alcohol,0,9,48,0.0,0.444
i need something easy to make at one point i ate  boiled eggs for breakfast  hardbread with a thin hamslice for lunch and same for dinner i did this for three months because i am that lazy i need easy cooked recipes i dont tire of same food every day please help,0,52,262,0.047,0.203
what would you guys recommend making for breakfast lunch and dinner if im athletic and do weights,0,17,97,0.0,0.135
cheap way to have a protein heavy diet,0,8,38,0.0,0.0
frugal tip i always see charcoal briquettes in the discount section of big stores during the summer,0,17,99,0.0,0.0
cheap and healthy snacks,0,4,24,0.0,0.474
easy premade sides,0,3,18,0.0,0.592
eating while working on the road,0,6,32,0.0,0.0
sauces for turkey or any other type of sandwhiches,0,9,50,0.0,0.0
is there any meal plan that covers all of the essential nutrients you need,0,14,74,0.0,0.0
psa bitterness can cut umamisaltiness,0,5,37,0.615,0.0
what is the healthiest way to cook baby carrots to taste better,0,12,63,0.0,0.209
looking for recommendations for reusable casserole pans,0,7,55,0.0,0.0
finally something cheap healthy and delicious to bring to social gatherings,0,11,75,0.0,0.416
my soulfood   mom's tomato tofu stirfry,0,6,39,0.0,0.0
worth getting an at home dehydrator,0,6,35,0.0,0.275
a question about bananas,0,4,24,0.0,0.0
not usually a big fan of tilapia but i baked the fish in a garlic  bacon broth and some random veggies in my fridge and it turned out surprisingly delicious and not too expensive,0,34,178,0.04,0.21
cheap healthy eating for  help,0,5,30,0.0,0.643
i need different food for lunch,0,6,31,0.0,0.0
noodles,0,1,7,0.0,0.0
taco bell dollar menu,0,4,21,0.0,0.0
crunchy snacks,0,2,14,0.0,0.0
breakfast ideas,0,2,15,0.0,0.0
meal prep tabouleh,0,3,18,0.0,0.0
tips for yummy budget food around   dollars for  vegannon vegan,0,10,63,0.0,0.274
help me make pork chops that taste better,0,8,41,0.0,0.483
can someone smarter break down proscons of different noodles,0,9,60,0.0,0.273
simple to prepare snack no gluten or lactose ,0,8,45,0.239,0.0
what's an easy and healthy snack i can take for my friends at the gym,0,15,69,0.0,0.442
i shared this on rrecipes but wanted to share here too sour cream and onion chicken meatballs   gluten free and really cheap to prepare,0,24,135,0.0,0.309
whats your fav cheaphealthy alcoholic drink,0,6,43,0.0,0.375
how is average every day rice actually prepared in asia,0,10,55,0.0,0.174
not the most relevant but wanted to ask here can someone live off a weekly csa community supported agriculture box,0,20,114,0.0,0.141
what is something that takes a while eat and doesn't have too many calories,0,14,75,0.0,0.0
easy goal list i put together for my accountability group easy to attain especially on a budget,0,17,95,0.0,0.309
more filling meals and ways to spice up eggs,0,9,44,0.0,0.0
natt beans are the shit,0,5,23,0.0,0.5
can't make the switch from  effort to healthy food,0,9,50,0.0,0.252
meal ideas for a picky eater,0,6,28,0.0,0.0
in the middle of a heatwave filling no cook meals,0,10,49,0.216,0.0
looking for cheap creative recipes,0,5,34,0.0,0.42
sweet potato oven dish,0,4,22,0.0,0.5
need a little help,0,4,18,0.0,0.546
 year old looking for a healthy diet plan for gym,0,10,49,0.0,0.252
healthy and inexpensive grocery list for  person everything can be bought off brand,0,13,83,0.0,0.184
is there any good alternative for ritz bits cheese sandwich crackers,0,11,68,0.0,0.225
what do you put in your crepes,0,7,30,0.0,0.0
depression meals,0,2,16,0.787,0.0
found a good hack for pre prepared food to make it cheaper and healthier,0,14,72,0.0,0.304
need help with what to buy for myself and another,0,10,49,0.0,0.231
summer meals,0,2,12,0.0,0.0
new mom freezer meal suggestions please,0,6,39,0.0,0.315
stupid question about rolled oats,0,5,33,0.459,0.0
fianc and i moving into our first place what groceries should we stock up on i wont see a first paycheck until the end of august,0,26,128,0.0,0.0
easy vegan breakfast avocado toast,0,5,34,0.0,0.42
recipes that require a lot of chopping and other knife skills,0,11,61,0.0,0.0
 ingredient or less meals,0,4,25,0.0,0.0
cheap throwaway calories,0,3,24,0.0,0.0
in search of lasting recipes and food items to take to army,0,12,59,0.0,0.0
need help with bland dinners,0,5,28,0.0,0.403
how can i make my morning smoothies cheaper need inspiration for cheap balanced filling shakes to get me through school as a mature broke student,0,25,145,0.097,0.214
burrito and sandwich recipes,0,4,28,0.0,0.0
going grocery shopping in about half hour any recommendations,0,9,61,0.0,0.0
trying to eat healthier unsure if i'm succeeding,0,8,48,0.179,0.286
suggestions for turkey shepherd's pie name please,0,7,49,0.0,0.277
oversoaked chikpeas cook or toss,0,5,32,0.0,0.0
volume eating,0,2,13,0.0,0.0
my favorite cheap summer side dish spicy charred sweet corn and cherry tomatoes,0,13,79,0.0,0.353
one pot recipes,0,3,15,0.0,0.0
toddler friendly daycare lunch recipes no microwave available,0,8,61,0.193,0.281
smoothies are only  of your  a day,0,7,34,0.0,0.0
what is your favorite cheap and healthy snacks,0,8,46,0.0,0.487
healthy juices to look for,0,5,26,0.0,0.403
my vote for the cheapest easiest and healthiest meal,0,9,52,0.0,0.259
what to getbuy after renting a place with one induction stove,0,11,61,0.0,0.0
healthiest cheapest and most sustainable meal,0,6,45,0.0,0.0
any cheap and healthy recipe ideas for rice noodles,0,9,51,0.0,0.252
ideas for tasty mashed potatoes that doesn't involve tons of butter and milk,0,13,76,0.0,0.0
vegetable beans and rice on a budget,0,7,36,0.0,0.0
what are some really simple but healthy smoothie recipes,0,9,56,0.0,0.33
best placeprice for fish chicken,0,5,32,0.0,0.512
need recipes for grounddicedcut chicken breast,0,6,46,0.0,0.0
soup diet ,0,2,10,0.0,0.0
best quick cheap and tasty mid week meal need some inspiration please,0,12,69,0.0,0.524
super easy and cheap tomato risotto recipe,0,7,42,0.0,0.576
expiration of granola,0,3,21,0.0,0.0
pan seared tofu,0,3,15,0.0,0.0
doctor gave me a new diet need advice,0,8,37,0.0,0.0
easy recipes for a fairly picky eater that can last all week or at least most of it bonus question any specific things to look for in a crock pot,0,30,145,0.0,0.204
smart ways to repurpose scraps amp throwaways instead of being wasteful,0,11,71,0.0,0.213
any idea how i can keep delivered food unspoiled until dinner,0,11,61,0.0,0.0
low cholesterol cheap and healthy meals,0,6,39,0.239,0.307
eggs amp tomato over rice recipe,0,6,32,0.0,0.0
how to like raw tomatoes,0,5,24,0.0,0.385
