title,subreddit,word_count,char_count,neg_sen,pos_sen
looking for some help with yeasts,0,6,33,0.0,0.351
any ides on how to improve plain cucumber,0,8,41,0.0,0.293
if you havent had a tuna salad quesadilla  you need to try this cheap and easy snack,0,17,84,0.0,0.162
what are some quick  calorie meals,0,6,34,0.0,0.0
stupid question what am i doing wrong with my poached eggs,0,11,58,0.448,0.0
drink ideas for family dinners that aren't super sugary,0,9,55,0.282,0.0
quick question on frozen fruit,0,5,30,0.0,0.0
is it possible to make hot cocoa with just milk and cocoa powder but no sweetener i'm trying to limit my consumption of sugarsweet stuffs as much as possible but worry this would make my hot cocoa bland,0,38,202,0.156,0.0
question about calories in chicken breast broth,0,7,47,0.0,0.0
how most students and everyone who needs a healthy easy cheap and quick meal in my country denmark eats cheap and healthy ryebread,0,23,130,0.0,0.304
looking for a cheap and easy snack for break at work,0,11,52,0.0,0.244
something better than chia   for magnesium,0,6,42,0.0,0.367
did i go about breaking my addiction in the right way,0,11,53,0.0,0.0
what isare you favorite food concoctions that taste good,0,9,56,0.0,0.457
need some filling low carb high protein and fat easy breakfasts that do not include egg,0,16,87,0.111,0.153
new diet starts tomorrow,0,4,24,0.0,0.0
any tasty gluten free suggestions,0,5,33,0.0,0.452
high protein low carb no sugar vegetarian suggestions please,0,9,60,0.341,0.183
go bananas,0,2,10,0.0,0.0
cheap and healthy snack ideas for young children on summer break,0,11,64,0.0,0.213
big cheap filling burrito suggestions needed please,0,7,51,0.0,0.277
frozen banana alternatives in smoothies,0,5,39,0.0,0.0
is there any healthy sauces to spread on shredded chicken breast,0,11,64,0.0,0.213
how do you spice your quiche,0,6,28,0.0,0.0
egg based sauces like carbonara,0,5,31,0.0,0.385
how to make tinned soup into a complete meal,0,9,44,0.0,0.0
something lighteasy to freeze and light carb,0,7,44,0.0,0.167
crunchy pea salad,0,3,17,0.0,0.0
what's cheaper pre dried fruit or dehydrating your own fruit,0,10,60,0.0,0.0
your favorite cold meals,0,4,24,0.0,0.5
does anyone have an idea for a lunch i can leave in my car,0,14,58,0.098,0.0
advicefeedback   trying to cook healthy and made a recipe,0,9,57,0.0,0.278
mayan chocolate and maple protein oatmeal,0,6,41,0.0,0.0
i buy a lot of junk food but would like to start making my own snacks,0,16,69,0.0,0.2
what's the cheapest way to buy nuts and seeds,0,9,45,0.223,0.0
how do you saut your onions,0,6,27,0.0,0.0
is weight loss all about   calories,0,6,35,0.315,0.0
what brands of olive oil do y'all like to use,0,10,45,0.0,0.217
ideas for carb replacement meals,0,5,32,0.0,0.0
herbs and spice suggestions,0,4,27,0.0,0.0
almost  ive been eating unhealthy my entire life fast food hamburger helpers and indulging in desserts are all ive known since childhood,0,22,136,0.133,0.082
messed up digestion is oats as staple diet good ,0,9,48,0.195,0.236
meal shakes most affordable and convenient way to eat clean meals i think so,0,14,76,0.0,0.184
fried zucchini  cooked peas  nice cheap and healthyish,0,8,54,0.0,0.286
hoping to move out with my boyfriend soon need help with budgetting and meal prep,0,15,81,0.0,0.297
vegan ish recipes for gaining weight,0,6,36,0.0,0.359
partner brought up on a diet of processed foods and meat straight up refuses vegetables,0,15,87,0.0,0.128
strawberry jam no pectin,0,4,24,0.423,0.0
creating a motivational page for healthfitness any advicereflections you had on your journey to becoming a better healthy you,0,19,125,0.0,0.358
i am avoiding sugarsnacks like chips but am obviously addicted and have massive cravings after meals,0,16,100,0.103,0.106
anyone have a speedyhacky way of creating fish patties from canned fish,0,12,71,0.0,0.18
help i want to eat more frozen fruits,0,8,37,0.0,0.444
so i made some comments earlier about hating corn tortillas well i made some tonight and they were unbelievable i got chills they were so good they are also cheap for  you get a four pound bag i'm sure you could find it even cheaper than that super easy to make as well,0,53,269,0.052,0.298
cheat days  what are your tipsadvice on this a little trouble,0,11,61,0.403,0.0
easy post work meals,0,4,20,0.0,0.492
popcorn saltspices that actually stay on the popcorn,0,8,52,0.0,0.0
what are your go to lazy meals,0,7,30,0.294,0.0
healthy snacks for a underweight diabetic,0,6,41,0.0,0.403
can anyone help put together a good grocery list,0,9,48,0.0,0.483
could anyone help me out with a potential grocery list i could give to my parent im young and want to start eating healthier but dont know where to begin,0,30,153,0.0,0.103
looking for macro based recipe websites,0,6,39,0.0,0.0
any good foods for a hypochondriac,0,6,34,0.0,0.42
cheap and healthy ways to deal with sweets cravings,0,9,51,0.0,0.457
tomato and egg stir fry,0,5,23,0.0,0.0
stir fry,0,2,8,0.0,0.0
easy bean recipe,0,3,16,0.0,0.592
for a cheap and healthy breakfast or snack,0,8,42,0.0,0.31
do you save the potato peels,0,6,28,0.0,0.39
did you grow up eating fufu,0,6,27,0.0,0.0
help me get my husband to like sardines,0,8,39,0.0,0.464
homemade tomato juice,0,3,21,0.0,0.0
todays lunch vegan,0,3,18,0.0,0.0
which meals can be prepped frozen then taken to work and reheated in a microwave,0,15,80,0.0,0.0
hit me with your best soya chunk recipe,0,8,39,0.0,0.375
summer salads that last in the fridge,0,7,37,0.0,0.0
im trying to eat  calories or less to help lose weight but i dont want to do it in an unhealthy way any meal ideas,0,25,114,0.261,0.058
how to eat healthy in a house that doesnt,0,9,41,0.0,0.278
most flavorful sparkling water,0,4,30,0.0,0.452
a six minute egg can transform your dish,0,8,40,0.0,0.0
uses for leftover pickle juice,0,5,30,0.0,0.0
what can you buy and eat with ,0,7,30,0.0,0.0
i just got home from work i'm exhausted hungry and my fridge is empty i'm two seconds away from ordering take out someone give me some suggestions before i make more poor choices,0,33,178,0.216,0.0
for lowmoderate sodium diets pringles,0,5,37,0.0,0.0
i made a healthy protein filled dinner tonight for less than ,0,11,61,0.0,0.252
amazingly tasty chicken avocado summer salad,0,6,44,0.0,0.0
my go to soup rotation,0,5,22,0.0,0.0
cheap suggestions for fish,0,4,26,0.0,0.0
eggs for someone who hates eggs asking for advice,0,9,49,0.266,0.0
vegan aloha kitchen week challenge,0,5,34,0.0,0.245
where to buy tortillas,0,4,22,0.0,0.0
what foods freeze well,0,4,22,0.0,0.623
favorite frozen veggie blend,0,4,28,0.0,0.5
cheap healthy filling mexican breakfastlunch,0,5,44,0.0,0.403
cheap delicious and calorie dense smoothies,0,6,43,0.0,0.425
food pantry life,0,3,16,0.0,0.0
favorite overnight oatsslow cooker recipes,0,5,42,0.0,0.429
add mushrooms to ground beef,0,5,28,0.0,0.0
way to eat can tuna,0,5,19,0.0,0.0
frozen hash brown patties,0,4,25,0.0,0.0
are frozen meatless options any good,0,6,36,0.0,0.367
i would like to request some cheap easy filling vegetable focused recipes,0,12,73,0.0,0.5
best way to store chicken dinner on the go,0,9,42,0.0,0.344
looking for camping ideas,0,4,25,0.0,0.0
rice cooker case against,0,4,24,0.0,0.0
steamed veggies,0,2,15,0.0,0.0
low fructose recipes,0,3,20,0.512,0.0
add cucumber to salsa for low cal crunch and bulk,0,10,49,0.189,0.0
favorite things to add to greek yogurt,0,7,38,0.0,0.333
ideas for someone who has trouble eating enough,0,8,47,0.278,0.0
looking for suggestions for new ways to season steak,0,9,52,0.0,0.0
cheap and healthy but mostly cheap  black beans ,0,8,48,0.0,0.209
this thick blended vegetable soup is a total game changer    cheap easy and healthy,0,14,83,0.0,0.337
another subreddit for budget eating   rbudgetmealplans,0,6,54,0.0,0.0
black bean  roasted root vegetable  red curry soup  leftover veggie yum,0,11,71,0.0,0.0
eating through the pantry before we move,0,7,40,0.0,0.0
i need a superfood that has all nutrients,0,8,41,0.0,0.0
overnight quinoa breakfast   this recipe is full of healthy antioxidants and has plenty of fiber,0,15,96,0.0,0.162
what are your go to cheap and healthy snacks to put a stop to hunger and buy you another hour before your next meal,0,24,115,0.156,0.1
i always see posts about found protein for x dollars bought all of it but how do you know thats a good deal,0,23,107,0.0,0.168
cooking imitation crab in the microwave,0,6,39,0.0,0.0
what are your pantry staples,0,5,28,0.0,0.0
sweet spirulina and spinach apple cider vinegar smoothiefor those who take acv,0,12,78,0.0,0.214
good protein and fat dense vegetarianpescatarian recipes for bulk,0,9,65,0.0,0.266
rice bowl meal prep recipes,0,5,27,0.0,0.0
food apps that include budgeting your wallet,0,7,44,0.0,0.0
whats the one thing you love to eat even though you know its not technically good,0,16,81,0.117,0.204
what to do with  hard boiled eggs,0,7,33,0.189,0.0
diy frozen yogurt,0,3,17,0.0,0.0
best salad dressing,0,3,19,0.0,0.677
i need advicesi know what to eat but not how much i should,0,13,58,0.0,0.0
poor man's rich soup,0,4,20,0.356,0.414
i was given two large bags of individually frozen boneless skinless chicken thighs,0,13,82,0.0,0.0
bought  pounds of brisket on sale need cooking ideas,0,9,52,0.0,0.0
whats the go to lazy meal for each time of day in your country or culture,0,16,73,0.143,0.0
developing a muscle and weight diet,0,6,35,0.0,0.0
whole roast chickens aren't as intimidating to prep as they seem and are a more economical way buy chicken,0,19,106,0.0,0.124
warning about fruit snacks,0,4,26,0.444,0.0
is there a way to freeze salads ,0,7,32,0.0,0.194
need healthy and cheap ideas for breakfast but i hate eggs,0,11,58,0.339,0.124
best ways to grillroast chicken breasts,0,6,39,0.0,0.457
need ideas for high protein snacks,0,6,34,0.0,0.0
uses for protein powder outside of smoothies,0,7,44,0.0,0.0
no oven never really learned to shop healthy what are some healthy foods i should always have in the house,0,20,106,0.093,0.229
need recipe ideas cooking for a small group away from civilization for several weeks,0,14,84,0.0,0.0
meals for gaining weight,0,4,24,0.0,0.483
decided a month ago to start eating healthy crossposting to rcastiron,0,11,69,0.0,0.231
need recipe suggestions   quinoa based and protein focused,0,8,58,0.0,0.271
cheaphealthyish meals to keep away from roommates,0,7,49,0.0,0.0
freezing fresh vegetables,0,3,25,0.298,0.489
im moving into my first apartment come august what are some of your best tipsrecipes for saving money,0,18,101,0.0,0.198
chicken paprikash incredibly cheap and delicious healthy enough for a richer meal every once in a while,0,17,103,0.0,0.456
is this a good price for meat for a month,0,10,41,0.0,0.293
can you microwave uncooked lentils faster than cooking them in a pot,0,12,68,0.0,0.0
how much fruit is too much,0,6,26,0.0,0.0
oven and hobs broken   got a microwave and grill   please give me meal ideas,0,14,76,0.189,0.14
highly nutritious meals that are easy enough for a teenager to make,0,12,67,0.0,0.225
teenage boy working  hours a day need to find a way to get full without consuming massive amounts of sodium,0,20,107,0.0,0.0
paleo diet how to successfully maintain without spending a lot of money,0,12,71,0.0,0.242
how to eat healthy on a budget,0,7,30,0.0,0.351
what do you do with disasters,0,6,29,0.419,0.0
simple recipes with frozen chicken thighs,0,6,41,0.0,0.0
breakfast and lunches with not microwave,0,6,40,0.0,0.0
tips for a mediterranean diet,0,5,29,0.0,0.0
ingredient question,0,2,19,0.0,0.0
due to some unexpected expenses i'll have just  for food this next month what can i buy for that,0,19,96,0.0,0.0
floaters in water after blanching kale,0,6,38,0.0,0.0
meals for a new mom to make,0,7,27,0.0,0.0
lazy but tasty no cook black bean corn salad,0,9,44,0.394,0.0
cheap and healthy for rv living,0,6,31,0.0,0.351
can frozen mixed veggies alone serve as the vegetable component of your diet,0,13,76,0.143,0.0
meals that can be made fully from convenience store food,0,10,56,0.0,0.0
do you find whole chickens worth it,0,7,35,0.0,0.241
what's the cheapest but most effective way to remove microplastics from tap water,0,13,81,0.0,0.277
meals to make for college students,0,6,34,0.0,0.0
can a food budget of under  annually be feasible,0,9,48,0.0,0.0
recipe request   costa rican gallo pinto,0,6,40,0.0,0.0
a cheap tasty pick me up that's not unhealthy,0,9,45,0.0,0.284
taco bowl meal prep,0,4,19,0.0,0.0
lunches that don't require refrigeration or microwave,0,7,53,0.0,0.0
canned fish,0,2,11,0.0,0.0
freezing yoghurt,0,2,16,0.583,0.0
how to budget  for food for next  days for  people,0,10,50,0.0,0.0
easy veg weeknight dinner,0,4,25,0.0,0.492
meal ideas for an apartment with no kitchen,0,8,43,0.239,0.0
party food for kids birthday party  adults and  kids  years old and under please help some dietary restrictions,0,18,111,0.0,0.426
cheap peanut butter substitutes,0,4,31,0.0,0.0
freezer meals for a friend in need,0,7,34,0.0,0.39
vegan stoner food,0,3,17,0.0,0.0
ramen hacks ramen eggs and,0,5,26,0.0,0.0
college cooking,0,2,15,0.0,0.0
some apple cider vinegar receipes,0,5,33,0.0,0.0
quick frozen veggie snacks,0,4,26,0.0,0.0
air fryer high protein vegetarian dishes,0,6,40,0.0,0.0
spend more at the grocery store if itll prevent you from eating out,0,13,67,0.0,0.084
instant and cheap option when i have no lunch,0,9,45,0.239,0.0
is it possible to unsalt peanuts,0,6,32,0.0,0.0
fears around raw meat,0,4,21,0.483,0.0
where to buy crispbreadbulk bin for seeds,0,7,41,0.0,0.0
i'm glad customers of soylent aren't partaking in cannibalism,0,9,61,0.0,0.273
healthy cook out foodsmenu plan,0,5,31,0.0,0.403
ramen with a twist,0,4,18,0.0,0.0
struggling to start eating healthier,0,5,36,0.412,0.0
grocery price comparison tool,0,4,29,0.0,0.0
need help on low to no sugar diet,0,8,33,0.358,0.225
keeping track of food,0,4,21,0.0,0.0
has anyone tried replacing greek yogurt w sour cream can you tell me the difference,0,15,83,0.0,0.0
need new protein tired of chicken breast,0,7,40,0.326,0.0
pineapple  cooked buckwheat is a healthy cheap and insanely delicious treat wo added sugars,0,14,91,0.0,0.476
stuck on eating cheap and healthy foods with minimal time to make,0,12,65,0.136,0.184
how to spice up a can of beans,0,8,30,0.0,0.0
cooking now for ,0,3,16,0.0,0.0
what i made with kitchen staples   one pot edition,0,9,50,0.0,0.0
is it healthy to eat bagels and eggs every day looking for cheap quick food options for lunch,0,18,93,0.0,0.137
lower cholesterol and sodium ideas,0,5,34,0.355,0.0
new level joke,0,3,14,0.0,0.524
craving desserts,0,2,16,0.0,0.0
super easy way to make rice taste better,0,8,40,0.0,0.66
will attend summer school abroad for one week dinners aren't included in the scholarship any suggestions on food to pack i don't have check in luggage so i dont have to check in every night,0,35,189,0.0,0.0
 yo boxerweight lifter looking for cheap high protein recipes,0,9,61,0.0,0.0
cheap gluten free recipes i can learn for university,0,9,52,0.0,0.32
is there any basic stuff that i dont have to prepare too much to enjoy,0,15,70,0.0,0.198
veggie pasta inquiry,0,3,20,0.0,0.0
what is your favorite lowno carb snackfood no meat,0,9,50,0.18,0.246
help cooking rice,0,3,17,0.0,0.574
need cheap meal ideas for the wife and i,0,9,40,0.0,0.0
extremely easy fast meal to make every day,0,8,42,0.0,0.313
how to eat cheap and healthy when you dont have a lot of free time,0,15,66,0.0,0.333
suggestion for quick and delicious multicooker recipe,0,7,53,0.0,0.381
my week saver  ingredients  pot  meals,0,6,38,0.0,0.0
are mandarin oranges good for a snack,0,7,37,0.0,0.367
tofu recipes,0,2,12,0.0,0.0
capers,0,1,6,0.0,0.0
cauliflower rice,0,2,16,0.0,0.0
so not exactly the correct place but worths shot,0,9,48,0.0,0.0
what can you do with carrots ,0,6,29,0.0,0.0
whats the difference with shopping at aldi,0,7,42,0.0,0.0
chipped beef on toast sos,0,5,25,0.0,0.0
cheaphealthyeasy to prep on vacation,0,5,36,0.0,0.0
my first meal prep,0,4,18,0.0,0.0
looking for help with meal planning with little vegetables,0,9,58,0.0,0.252
student on a budget need help loosing weight,0,8,44,0.0,0.31
just starting,0,2,13,0.0,0.0
ways to reheatcook broccoli,0,4,27,0.0,0.0
uses for hotdogs for people who don't like hotdogs,0,9,50,0.209,0.0
easy meals for someone with physical limitations,0,7,48,0.0,0.326
what are your favorite low cholesterol meal preps,0,8,49,0.189,0.27
how do i make a meal more fillinglast longer without carbs,0,11,58,0.0,0.0
asking after meatless monday recipes with relatively low carbs,0,9,62,0.208,0.0
what are your tips on not getting burnt out on your healthy journey be it consistent weight loss consistent cookingi need tips,0,22,126,0.092,0.108
cheap  day diet plan for a newbie triathlete,0,8,44,0.0,0.0
is amazon prime pantry a good place to get cheap food  is it cheaper or comparable to walmart or aldi does anyone have any experience with it,0,27,141,0.0,0.161
is it safe to eat instant oatmeal in my protein shake without heating it,0,14,72,0.102,0.175
some meal ideas for those who hate to cook,0,9,42,0.316,0.0
day meal plan with vegetarian substitutes,0,6,41,0.0,0.0
is about  for  meals  snacks x  people for  days decent spending wise,0,12,69,0.0,0.237
any low carb high protein meals for pescatarians,0,8,48,0.231,0.0
any alternative to chips and junk when studying in library for longer hours,0,13,75,0.0,0.0
mild meal prep tips,0,4,19,0.0,0.0
whats a food you were surprised at the calories,0,9,47,0.0,0.213
simple jello ideas,0,3,18,0.0,0.0
ground turkey and ,0,3,18,0.0,0.0
thrive market,0,2,13,0.0,0.0
recipes with the specific ingredients given,0,6,43,0.0,0.0
my easy hemp chai recipe video,0,6,30,0.0,0.367
i am trying to eat cheap healthy and good for the climate looking for some pointers,0,16,83,0.0,0.301
i sometimes travel for a week or two and try to stay at places with at least a basic kitchenette ideas on how to shopprepare cheap and healthy meals with minimal prep and more importantly minimal waste for just a week or two i dont eat red meat love spicy foods and am open to whatever else,0,57,290,0.051,0.157
feeding child with diet needs,0,5,29,0.0,0.0
bbq recipes,0,2,11,0.0,0.0
the great chili thread is chili intrinsically healthy what are your inexpensive healthy chili recipes what healthy toppings or sides to you prefer,0,23,146,0.0,0.391
 year old lookin to lose weight for the summer,0,9,46,0.252,0.0
what are some healthy alternatives to rice as a side dish,0,11,57,0.0,0.231
i eat instant noodles twice a week with eggs and veggies would this affect my health drastically,0,17,96,0.0,0.0
where can i find a meal plan do any of you want to share,0,14,56,0.0,0.259
spicy v,0,2,7,0.0,0.0
looking to burn fat how does this meal plan look,0,10,48,0.0,0.0
big batch pre fried rice,0,5,24,0.0,0.0
too much quiche filling,0,4,23,0.0,0.0
can i make a few servings of a smoothie and save it for later,0,14,61,0.0,0.242
i have food looking for recipes,0,6,31,0.0,0.0
homemade sloppy joe mix,0,4,23,0.0,0.0
how do i avoid waking up hungry in the middle of the night,0,13,58,0.167,0.0
moving to an expensive area   what are some of your fave cheapeasy recipes,0,13,74,0.0,0.195
how much do you pay for a dozen eggs where you live,0,12,51,0.123,0.0
what to make with chia flour,0,6,28,0.0,0.0
true  min hands on time meals,0,6,29,0.0,0.359
walmart substituted sprouts for two large heads of cabbage what are some things i can cook that are mainly cabbage,0,20,114,0.0,0.0
what are some good salad recipes for breakfast to keep you filled for  hours,0,14,76,0.0,0.182
