title,subreddit,word_count,char_count,neg_sen,pos_sen
ancho chile puree braised chicken tacos  taco tuesday ep,1,9,56,0.0,0.0
recipes for college student,1,4,27,0.0,0.0
fluffy apple roll cake,1,4,22,0.0,0.0
easy potato curry,1,3,17,0.0,0.592
budget friendly korean soft tofu stew,1,6,37,0.0,0.39
potato fries veg pizza,1,4,22,0.0,0.0
 the best sandwich ever ,1,4,24,0.0,0.583
bibingka   baked rice cake   manila philippines street food,1,8,59,0.0,0.0
japanese soy cured umami egg yolks   johnny row cooks,1,9,53,0.0,0.0
how to make the best burger buns of all time,1,10,44,0.0,0.318
creamy curry recipe,1,3,19,0.0,0.0
 kfc cheetos sandwich review,1,4,28,0.0,0.0
how to make chicken jalfrezi  indian chicken curry recipe  cook with nabeela,1,12,76,0.0,0.0
california poke bowl,1,3,20,0.0,0.0
how to make anda aloo curry  egg and potato curry recipe  cook with nabeela,1,14,75,0.0,0.0
my grandma's meatballs in tomato gravy,1,6,38,0.0,0.0
egg tarts recipe,1,3,16,0.0,0.0
 hungarian gundel pancake ,1,3,26,0.0,0.0
quick breakfast paratha making  lachha paratha at street food of karachi  paratha king,1,13,86,0.0,0.0
how to make japanese pub style fried chicken  tori no karaage   johnny row cooks,1,14,80,0.145,0.0
chicken shawarma recipe  world famous recipe  street food of karachi pakistan,1,11,77,0.0,0.0
sweet sauce sweet just like us,1,6,30,0.0,0.739
lachha paratha  paratha at cafe bhaijaan  ramadan special at street food of karachi,1,13,83,0.0,0.184
yogurt toast,1,2,12,0.0,0.0
veggie tacos recipe,1,3,19,0.0,0.0
matcha green tea blueberry crepe cake,1,6,37,0.0,0.0
flaming beef on a hot plate in vietnam at ,1,9,42,0.0,0.0
super burger and fast food  triple layer burger  bun kabab  fastest workers,1,12,75,0.0,0.262
butter vanilla cookies with jelly,1,5,33,0.0,0.0
tapioca pearls fry,1,3,18,0.0,0.0
mutton kebabs street food style,1,5,31,0.0,0.0
anday wala burger  famous bun kabab of burns road karachi,1,10,57,0.0,0.0
how to grill in under ,1,5,22,0.0,0.0
cheap meals for under  bucks for two for  days,1,9,46,0.0,0.0
 high protein pancake  with oatmeal and poppy seed,1,8,50,0.0,0.0
banana apple muffins with butter cream,1,6,38,0.0,0.0
lobster nasi lemak  mentaiko beef cubes  ramadan bazaar   singapore street food,1,11,79,0.0,0.0
microwave spicy potatoes,1,3,24,0.0,0.0
 unique food vending machine,1,4,28,0.0,0.0
what should i do with some leftover shredded chicken that got too dry,1,13,69,0.0,0.0
frugal eats help,1,3,16,0.0,0.574
daisy lemon cheesecake,1,3,22,0.0,0.0
chicken amp cheese biscuits,1,4,27,0.0,0.0
baked fish recipe,1,3,17,0.0,0.0
chicken peri peri,1,3,17,0.0,0.0
al rehman biryani  famous hyderabadi biryani  chicken biryani,1,8,61,0.0,0.0
vegan lunch and dinner recipes l easy vegan dinner recipes,1,10,58,0.0,0.266
ragda pattice street food i had yesterday,1,7,41,0.0,0.0
bacon spaghetti,1,2,15,0.0,0.0
mango juice  mango shake in just rs  street food of karachi pakistan,1,12,68,0.134,0.0
 authnetic hungarian beef goulash ,1,4,34,0.0,0.0
spicy hash browns,1,3,17,0.0,0.0
cheap amp easy slow cooker pork chops amp gravy recipe   less than  per serving,1,14,79,0.0,0.182
chicken masala recipe  how to make chicken masala curry  cook with nabeela,1,12,74,0.0,0.0
need help making not ramen,1,5,26,0.0,0.403
spicy and tangy paneer,1,4,22,0.0,0.0
vegan cauliflower recipe,1,3,24,0.0,0.0
vegetable pilau a quick and easy solution to a hungry stomach,1,11,61,0.0,0.426
jackfruit milkshake  protein kathal shake at street food of karachi,1,10,67,0.159,0.0
fluffy pancakes,1,2,15,0.0,0.0
red garlic sauce one of the best sauces i've tasted in a while,1,13,62,0.0,0.276
amritsari aloo chole,1,3,20,0.0,0.0
strawberry boston cream danish,1,4,30,0.0,0.0
mutton biryani an all time favourite,1,6,36,0.0,0.0
fish biryani divine and delicious,1,5,33,0.0,0.709
how to make chicken pakora  crispy chicken recipe  cook with nabeela,1,11,68,0.0,0.0
salted egg yolk sotong amp fish skin made in malaysia street food,1,12,65,0.0,0.0
soft milk loaf  milk bread recipe,1,6,33,0.0,0.0
cheap food at vietnam night market  ben thanh market  grilled fresh oyster  big head prawn,1,15,90,0.0,0.141
cheap street food in malaysia gigantic grilled mushrooms and doraemon bun,1,11,73,0.0,0.0
masala pav a dish of spice and taste,1,8,36,0.0,0.0
strawberry jam no pectin,1,4,24,0.423,0.0
flourless chocolate cake,1,3,24,0.0,0.0
how to make chicken tandoori  cook with nabeela,1,8,47,0.0,0.0
thandai a quick refreshing drink,1,5,32,0.0,0.0
russian chicken legs with potato grill,1,6,38,0.0,0.0
pav bhaji street food,1,4,21,0.0,0.0
creamy chicken kebabs,1,3,21,0.0,0.0
healthy chicken casserole only  per plate,1,6,41,0.0,0.351
eating cheap and easy for a couple,1,7,34,0.0,0.367
famous lassi of hyderabad  fastest lassi maker in hyderabad  lassi,1,10,66,0.0,0.0
pineapple coconut cake,1,3,22,0.0,0.0
how to make aloo pakora  potato fritters  cook with nabeela,1,10,59,0.0,0.0
spicy flattened rice,1,3,20,0.0,0.0
fried chicken biryani just delicious,1,5,36,0.0,0.481
ghousia nalli biryani  beef nalli biryani at street food of karachi pakistan,1,12,76,0.0,0.0
spring dosa quick and cheap,1,5,27,0.0,0.0
i've made roldrecipes as a place to share old family recipes and recipes from very old cookbooks like the ones found on project gutenberg please come join me   a lot of these recipes make good use of simple ingredients,1,39,218,0.0,0.279
somebodey lest their kebab and yeah i wanna eat it,1,10,50,0.0,0.216
cilantro mint rice,1,3,18,0.0,0.0
dahi batata puri famous street food,1,6,35,0.0,0.0
how to make mango kadhi an indian curry,1,8,39,0.0,0.0
indian flatbread   parotta,1,3,26,0.0,0.0
easiest and cheapest chicken lollipop,1,5,37,0.0,0.412
        quick mutton curry recipe in hindi  indian mutton curry,1,9,63,0.0,0.0
trrudi hungarian cottage cheese dessert cold snack,1,7,50,0.0,0.0
rhubarb strawberry soup recipe,1,4,30,0.0,0.0
chicken shawarma arabic style,1,4,29,0.0,0.0
tropical punch tea world famous,1,5,31,0.0,0.0
how to make chana curry  chickpea curry  cook with nabeela,1,10,58,0.0,0.0
the cheapest european chicken recipe,1,5,36,0.0,0.0
 meal that feeds family of  poor man's pigs in a blanket,1,11,56,0.256,0.0
special dum biryani an indian and pakistani special,1,8,51,0.0,0.474
one pot bacon cheeseburger macaroni   like hamburger helper but better,1,10,70,0.0,0.51
cold dessert recipe with ice cream fresh delicious and easy,1,10,59,0.0,0.56
ratatouille sort of for under ,1,5,30,0.0,0.0
vegan hot and sour soup healthy and delicious,1,8,45,0.0,0.516
russian omelet bullet,1,3,21,0.0,0.0
lime and grape cream tart,1,5,25,0.0,0.0
masala fish fry at breeze fish restaurant  crispy fired fish  delicious and spicy fish fry recipe,1,16,97,0.169,0.174
the red peanut chutney the best side dish i've come across just delicious,1,13,73,0.0,0.418
spicy shrimp with couscous quinoa salad,1,6,39,0.0,0.0
russian crispy honey glazed fried chicken,1,6,41,0.0,0.0
chocolate baskets with strawberry bananas and whip cream by chef naydenov  sushi and desserts,1,14,93,0.0,0.0
easy and quick fish curry,1,5,25,0.0,0.42
how to cook spicy masala fish curry easy recipe,1,9,47,0.0,0.266
quick amp easy chicken alfredo    minute cheap dinner,1,8,53,0.0,0.293
easy one pot cajun chicken fettuccine alfredo   great for busy weeknights,1,11,73,0.0,0.438
zebra cheesecake,1,2,16,0.0,0.0
chicken recipe in  minutes with the easiest and cheapest way ,1,10,61,0.0,0.237
how to make kfc popcorn chicken  the easiest and cheapest way,1,11,61,0.0,0.219
tiramisu cake recipe    ,1,3,24,0.0,0.0
wonderful korean chicken fryyangnyeom tongdak  tried to make it cheap,1,10,69,0.0,0.291
french macaron recipe,1,3,21,0.0,0.0
cheapest pizza recipe  sausage pan pizza,1,6,40,0.0,0.0
japchae   korea's  stir fried noodle recipe  johnny row cooks,1,9,61,0.0,0.0
easy and cheapest potatoe breakfast recipe,1,6,42,0.0,0.367
kfc fried chicken made with least ingredients but appeared better than kfc,1,12,74,0.0,0.259
cheaply and easily made meat curry by russian chef,1,9,50,0.0,0.231
meatball garlic bread,1,3,21,0.0,0.0
white sauce pasta and chicken bake creamy bechamel sauce easy steps,1,11,67,0.0,0.225
turkey steak with cheesy roasted broccoli mashed potatoes and a rosemary tarragon and cardamom chicken velout,1,16,109,0.0,0.0
ny strip carrots rice and bread,1,6,31,0.0,0.0
vanilla mango crepe cake,1,4,24,0.0,0.0
bun kabab recipe  anday wala burger  famous bun kabab on street food hyderabad,1,13,78,0.0,0.0
the cheapest eggs breakfast,1,4,27,0.0,0.0
easy strawberry pie how to make pie at home ,1,9,44,0.0,0.266
the cheapest potato recipe but so yummy,1,7,39,0.0,0.502
dal khichdi recipe with paneer an indian rice dish,1,9,50,0.0,0.0
feast fit for a king pepperoni deep dish pizza with coke,1,11,56,0.0,0.217
apple crumble cheesecake,1,3,24,0.0,0.0
halwa puri at dhamthal  best halwa puri of pakistan  nashta street food,1,12,71,0.0,0.276
kfc style fried chicken recipe,1,5,30,0.0,0.0
peach chili chicken,1,3,19,0.0,0.0
falooda recipe  ice cream falooda  royal rabri falooda,1,8,54,0.0,0.0
zucchini pizza,1,2,14,0.0,0.0
no bake chocolate cheesecake,1,4,28,0.423,0.0
people are crazy for pulao  biryani  yakhni pulao  ramzan special,1,10,65,0.183,0.206
no bake blackcurrant cheesecake recipe     ,1,5,43,0.355,0.0
zapienkanki polish open sandwich recipe  ,1,5,41,0.0,0.0
cheap amp easy enchilada casserole recipe one of our very favorite meals,1,12,72,0.0,0.382
potato garmoshkaharmonica potatoes,1,3,34,0.0,0.0
 hungarian pizza with egg on top tips healthy baking in oven,1,11,60,0.0,0.333
my tuna salad rules,1,4,19,0.0,0.0
boiled cabbage sausage and mashed potatoes,1,6,42,0.0,0.0
kunafa simple and very delicious,1,5,32,0.0,0.5
sandwich recipe for the lazy ones ,1,6,34,0.333,0.0
beef short rib sweet potato hash and spinach chimichurri cost around  and have left over sauce,1,16,94,0.0,0.167
spinach and swiss stuffed chicken,1,5,33,0.0,0.0
amazingly delicious teriyaki chicken sandwich,1,5,45,0.0,0.5
eggs breakfast the easiest method,1,5,33,0.0,0.412
halal cart style chicken and rice,1,6,33,0.0,0.0
russian style eggs with potatoestomatoes and sausages,1,7,53,0.0,0.0
don't throw out your old ripe bananas make banana bread instead,1,11,63,0.0,0.0
crispy cabbage pakora made so simple,1,6,36,0.0,0.0
russian beef liver curry,1,4,24,0.0,0.0
starting to get a hang of this healthy eating thing,1,10,51,0.0,0.281
 off your doordash delivery order dm for details,1,8,48,0.0,0.0
russian uzbeki meal kurdak,1,4,26,0.0,0.0
 semolina milk pudding     minutes high protein sweet,1,7,53,0.0,0.333
pizza master class,1,3,18,0.0,0.0
french toast recipe simple ways,1,5,31,0.0,0.0
lantern shaped eggplant,1,3,23,0.0,0.0
homemade doughnutsdonuts,1,2,24,0.0,0.0
how to make homemade smoked cheese for cheap,1,8,44,0.0,0.0
baba fish  fired fish at street food of karachi,1,9,47,0.31,0.0
easy beef tripe recipe,1,4,22,0.0,0.492
easy potato recipe,1,3,18,0.0,0.592
kachori recipe  aloo ki kachori at street food of karachi  khasta kachori,1,12,73,0.0,0.0
smoked chicken and garlic pizza,1,5,31,0.0,0.0
what can i make with what i have quinoa brown rice black beans cream of chicken cream of mushroom peascorncarrots riced cauliflowerbroccolibutternut squash butter italian style bread crumbs and spices galore,1,31,207,0.0,0.0
grilled cheese sandwich with parmesan crust sandwich casero,1,8,59,0.0,0.0
where can i buy a big thing of ramen noodle cups that would last me a week,1,17,74,0.0,0.0
taco salad,1,2,10,0.0,0.0
easy and quick recipe pasta in one pot,1,8,38,0.0,0.293
kfc spicy chicken fry,1,4,21,0.0,0.0
cheap and easy pasta salad,1,5,26,0.0,0.42
indian flat bread  made easy,1,5,28,0.0,0.42
what can i make out of hot dog broth,1,9,36,0.0,0.0
fluffy russian pancakes   oladushki recipe,1,5,42,0.0,0.0
pan baked chicken thighs,1,4,24,0.0,0.0
paratha roll  kabab paratha roll  paratha restaurant  street food,1,9,65,0.0,0.0
haji mehfooz sheermal house  best sheermal roti  naan roti,1,9,58,0.0,0.344
homemade oven   roasted chicken leg quarters recipesuper easy and very delicious,1,11,80,0.0,0.434
ramen kings who eat  bowls everyday secret recipe from shin ramyun black developers,1,13,83,0.0,0.0
fried chicken made simple,1,4,25,0.0,0.0
dulhan paratha  famous paratha of hyderabad  parath recipe  chicken paratha,1,10,75,0.0,0.0
bacon wrapped chicken cordon bleu,1,5,33,0.0,0.0
c  grilled fish made easy,1,5,25,0.0,0.492
back at it agin with the hollowed out bread this time with fish and romaine lettuce,1,16,83,0.0,0.0
kfc style popcorn chicken,1,4,25,0.0,0.0
make delicious and tasty strawberry crumble recipe,1,7,50,0.0,0.381
big meal small price  the jar of sauce   chicken breast  express rice  peppers onions spinach  meal   this is in euro by the way ,1,23,129,0.0,0.0
pasta with lanchon and cheese  ready in less  minutes,1,9,53,0.0,0.238
masala fish fry  made easy,1,5,26,0.0,0.42
senate bean soup,1,3,16,0.0,0.0
spicy chicken over mashed potatoes super cheap and easy,1,9,55,0.0,0.493
falafel recipe,1,2,14,0.0,0.0
curry kidney beans w rice,1,5,25,0.0,0.0
cheaper than a restaurant more expensive than a tv dinner,1,10,57,0.0,0.0
catfish curry made easy by russian chef,1,7,39,0.0,0.326
lentil recipe made easy,1,4,23,0.0,0.492
broke college hot dog food item,1,6,31,0.359,0.0
crispy fried chicken recipe homemade,1,5,36,0.0,0.0
rice and fried cabbage  eurocent per serving without  with joghurt,1,10,66,0.0,0.0
karachi ice cream  jumbo ice cream cone  best ice cream of karachi pakistan,1,13,75,0.0,0.259
efficiency is everything the cookbook,1,5,37,0.0,0.385
ginger chicken   text recipe in the comments,1,7,44,0.0,0.0
a delicious wrap under  calories with  grams of protein  lose weight ,1,11,69,0.188,0.257
meal prep baked chicken breasts,1,5,31,0.0,0.0
homemadelazy cake,1,2,17,0.0,0.0
perogies caramelized onions with a salad for only  a person,1,10,59,0.0,0.0
the best budget air fryers   simple way to make healthy cheap food taste delicious,1,14,82,0.0,0.491
minced meat potato and eggplantvery easy and delicious,1,8,54,0.0,0.524
cheap and easy to make healthy vegan wraps,1,8,42,0.0,0.483
mashed potato fritters tortitas de papa,1,6,39,0.0,0.0
homemade rice with beef and carrot rice pilaf,1,8,45,0.0,0.0
pan fried steak i picked up for  and scrambled eggs with melted white american,1,14,78,0.0,0.0
bbq grilled pomfret fish in  per kg and bbq grilled prawn in  per kg,1,14,68,0.0,0.0
spicy chicken gravy made ridiculously simple,1,6,44,0.324,0.0
buttermik chicken biryani made easy,1,5,35,0.0,0.42
lasagna,1,1,7,0.0,0.0
karachi beef burger  price is  cent only,1,7,40,0.0,0.0
homemade crispy fried chicken,1,4,29,0.0,0.0
let's make egg bread sandwiches video recipe   these sandwiches are made with simple ingredients and they are really tasty what do you think about this recipe ,1,26,159,0.0,0.0
how to make corn milk,1,5,21,0.0,0.0
fried fish with a sweet and sour sauce,1,8,38,0.0,0.333
hommade easy mexican chicken recipe,1,5,35,0.0,0.42
indian rajma masala curry recipe,1,5,32,0.0,0.0
homemade meatballs,1,2,18,0.0,0.0
beef bolognese,1,2,14,0.0,0.0
spicy indian pepper chicken recipe,1,5,34,0.0,0.0
fried rice with egg,1,4,19,0.0,0.0
my friend got a new camera during christmas so we decided to start a youtube channel i hope we can share on of our videos with you would love to know what you guys think the camera cost  but at least this pasta cost us  per serving to make,1,49,239,0.0,0.164
homemade pasta with bechamel,1,4,28,0.0,0.0
cheese bread palitos de queso,1,5,29,0.0,0.0
crispy fried shrimp,1,3,19,0.0,0.0
spicy indian paneercottage cheese easy recipe,1,6,45,0.0,0.367
and i have half a can of sardines left over so this probably cost around a buck buck and a quarter,1,21,98,0.0,0.0
korean chicken fryyangnyeom tongdak made easy,1,6,45,0.0,0.367
sardines   delicious indian fish curry recipe,1,6,45,0.0,0.425
european vegetable salad,1,3,24,0.0,0.0
masala fish fry and fish market vlog in russia,1,9,46,0.0,0.0
coleslaw made easy,1,3,18,0.0,0.592
fancy ramen serving,1,3,19,0.0,0.0
stir fry noodles,1,3,16,0.0,0.0
russian pilaf made easy and funny,1,6,33,0.0,0.592
making tofu dim sum with simple ingredients recipe in the comment,1,11,65,0.0,0.0
this pasta is made delicious with mostly items you probably already have i only bought the kroger brand swedish meatballs which is  for a big bag i had angel hair on hand already but a box obky cost about  here if you dont already had butter shaker parmesan and parsly,1,50,268,0.0,0.092
fill your mushrooms and make tasty appetizersnack rellena los sombreros,1,10,71,0.0,0.0
cow intestines recipe by russian chef,1,6,37,0.0,0.0
cheap oats recipes from horrible no taste to amazing taste,1,10,58,0.345,0.23
japanese curry ,1,2,15,0.0,0.0
russian chef made spicy fish curry,1,6,34,0.0,0.0
asian lettuce wraps,1,3,19,0.0,0.0
please take this survey for a food delivery concept for a school design project not collecting emails anonymous thanks,1,19,118,0.0,0.257
buttermik fried chicken  made easy,1,5,34,0.0,0.42
crispy oven baked potato wedges papas al horno,1,8,46,0.0,0.0
this belongs in the cheap eats olympics,1,7,39,0.0,0.0
shiny chocolate glaze recipe easy to make at home for a mirror cake step by step,1,16,80,0.0,0.172
fish with potato curry   the simplest way,1,7,41,0.0,0.0
how to make a delicious baked spaghetti casserole,1,8,49,0.0,0.381
rice with milk and pudding orange,1,6,33,0.0,0.0
chicken in oven with achiote paste pollo al achiote,1,9,51,0.0,0.0
college student makes avocado egg with toast,1,7,44,0.0,0.0
making a delicious salad in  seconds,1,6,36,0.0,0.481
paratha and omelet recipe  quick breakfast paratha making  street food of karachi,1,12,81,0.0,0.0
how to make desi chinese maggi noodles  quick maggi recipe        ,1,10,66,0.0,0.0
college student makes zucchini pasta,1,5,36,0.0,0.0
delicious strawberry bavarois on sponge cake,1,6,44,0.0,0.425
russian food macaroni with vegetables made easy,1,7,47,0.0,0.326
kraut burgers grilled chicken patties covered with homemade purple sauerkraut and wrapped in italian bread dough then baked cheap tasty and portable,1,22,148,0.0,0.0
biscuits bisquets caserosmuy faciles,1,4,36,0.0,0.0
baked lemon chicken thighs,1,4,26,0.0,0.0
fast food ad vs reality experiment,1,6,34,0.0,0.0
cheap meals for every one,1,5,25,0.0,0.0
bought a cheap turkey after christmas turk for days,1,9,51,0.0,0.0
yummy and easy italian pasta salad,1,6,34,0.0,0.612
yakimeshi fried rice   the best fried rice you'll ever make at home,1,12,67,0.0,0.276
how to make sheermal roti,1,5,25,0.0,0.0
healthy homemade carrot juice with yogurt,1,6,41,0.0,0.351
yummy homemade breaded fish whiting fillets,1,6,43,0.0,0.405
cheapest japanese instant food to eat,1,6,37,0.0,0.0
how to make a delicious baked spaghetti casserole,1,8,49,0.0,0.381
please ignore our rd roommates garbage on my coffee table,1,10,57,0.195,0.18
fish head curry made really simple,1,6,34,0.0,0.0
chicken with potato curry simply made,1,6,37,0.0,0.0
the frugal discord,1,3,18,0.574,0.0
pulled pork in slow cooker is surprisingly cheap cost me  lots of left overs,1,14,76,0.0,0.145
rabbit stew rabbit is as much as a  bullet if u already have hunting license  carrots potatoes celery and onions,1,20,112,0.0,0.0
perfect chocolate covered strawberry ice cream bars,1,7,51,0.0,0.381
creamy zucchini potato gratin zucchini dauphinoise,1,6,50,0.0,0.219
ramen   poached eggsreally easy i nailed it on my first try,1,11,59,0.0,0.244
how to cook simple amp tasty desi chinese maggi noodles        ,1,10,63,0.0,0.0
how to make a perfect french crepes with strawberries for kids,1,11,62,0.0,0.291
spicy masala fish curry made easy,1,6,33,0.0,0.367
beef gyudon yoshinoya recipe   way better than yoshinoya,1,8,56,0.0,0.293
new amp tasty maggi arrabbiata    maggi arrabbiata,1,7,50,0.0,0.0
best homemade croquette potatoes,1,4,32,0.0,0.583
traditional shrimp curry or malaikari  made easy,1,7,48,0.0,0.326
spaghetti neapolitan ketchup spaghetti   four ingredients that you definitely havecan easily substitute,1,12,103,0.0,0.338
yummy spaghetti with tomato sauce carrots and marjoram,1,8,54,0.0,0.327
black bean soup  cents for black beans rinse and blend with some tomato paste or half cup salsa is best then heat and done  meal,1,25,128,0.0,0.149
leek and potato soup,1,4,20,0.0,0.0
loaded potato bites,1,3,19,0.0,0.0
cheap football dip,1,3,18,0.0,0.0
this looks pretty cheap but so so good check out this spanish style chicken and rice recipe,1,17,91,0.0,0.34
cheap,1,1,5,0.0,0.0
fast and cheap chinese fried noodles,1,6,36,0.0,0.0
mississippi pot roast,1,3,21,0.0,0.0
quick and easy butter chicken,1,5,29,0.0,0.42
the simplest method of making buttermik chicken biryani,1,8,55,0.0,0.0
mother in law gave us a giant can of received beans any ideas on how we can use this up,1,20,87,0.0,0.0
the cheapest method of making russian meat dumplings,1,8,52,0.157,0.0
chicken steamed in banana leaves garang asem,1,7,44,0.0,0.0
have some left over noodles laying around you can make a fast easy and cheap meal with any ingredients you like,1,21,111,0.0,0.231
spicy street vapa pitha only  dollar,1,6,36,0.0,0.0
homemade white chicken chili,1,4,28,0.0,0.0
pad thai oatmeal lt microwave only,1,6,34,0.0,0.0
village style crispy coriander fry ultimate street food,1,8,55,0.0,0.0
fast simple amp taty char kuey teow in kuala lumpur for usd ,1,12,60,0.0,0.0
amazing cooking skills  burger making  bun kabab street food of hyderabad,1,11,73,0.0,0.275
simple croquette recipe,1,3,23,0.0,0.0
russian kids trying to make the simplest kfc chicken fry recipe,1,11,63,0.0,0.0
simplestcheapest way of making spicy kfc chicken,1,7,48,0.0,0.0
my latest cooking tutorial breakfast beans ,1,6,43,0.0,0.0
grilled stuffed jalapenos  full recipe  easy to make easy to eat,1,11,64,0.0,0.392
how to cook yellow rice nasi kuning,1,7,35,0.0,0.0
olive garden zuppa toscana soup using the instant pot,1,9,53,0.0,0.0
so yummy chicken cheese cutlet ,1,5,31,0.0,0.48
crispy fired fish  fish fry at karachi street food,1,9,50,0.31,0.0
the simplest way of making fish finger fish popcorn recipe,1,10,58,0.0,0.0
mutton curry without onions  simple indian mutton curry recipe  easy mutton recipes,1,12,83,0.0,0.209
cheapest simple whole food meals,1,5,32,0.0,0.0
home made pan pizza,1,4,19,0.0,0.0
capsicum curry  capsicum masala curry  simple capsicum curry,1,8,60,0.0,0.0
angry burger bun kabab at street food of karachi  burger king,1,11,61,0.248,0.0
what would be the basic cooking essentials,1,7,42,0.0,0.0
peanut chikki at street food of karachi pakistan,1,8,48,0.0,0.0
marbles guliyochristmas sweets  mangalorean kuswar,1,5,50,0.0,0.444
how to cook ridiculously simple quick and easy spicy chicken gravy,1,11,66,0.168,0.203
best recipe,1,2,11,0.0,0.808
special chicken charga at street food of karachi pakistan,1,9,57,0.0,0.252
namak pare recipe  how to make pakora  street food,1,9,50,0.0,0.0
x post from rindianfood indian recipe  budget meal  paneer bhurji dhaba style  indian style cottage cheese,1,16,106,0.0,0.0
fast and cheap at home meal,1,6,27,0.0,0.0
experiences with managers specials at grocery stores because of food nearing expiration,1,12,87,0.0,0.0
special egg burger  bun kabab,1,5,29,0.0,0.403
how to make biscuit  full recipe,1,6,32,0.0,0.0
how to make french fries  big chips recipe,1,8,42,0.0,0.0
garlic oatmeal ala garlic bread costs  and takes  minutes in the microwave,1,12,74,0.0,0.0
chicken shawarma recipe  how to make shawarma  street food,1,9,58,0.0,0.0
winter recipes  chicken corn soup in winter  street food of karachi pa,1,12,70,0.0,0.0
veg amp tasty maggi arrabbiata    maggi arrabbiata,1,7,50,0.0,0.0
luffa soup recipe,1,3,17,0.0,0.0
iconic fish and chips coming in at a solid  per portion or even cheaper depending on what fish you get,1,20,102,0.0,0.082
easy fried cheese balls recipe with only two ingredients  peanut dip dip is optional bolitas de queso fritas muy fciles,1,20,119,0.0,0.132
whats your favorite christmas eve easy meal we usually make chili but i want to do something else this year i know its early just want to get some ideas,1,30,152,0.0,0.222
easy stuffed baked potatoes filled with hamspring onion and cheese papas rellenas gratinadas,1,13,92,0.0,0.195
kofta arayes  kofta bil khobaz recipe,1,6,37,0.0,0.0
osaka dontonbori rice bowls nikugekijou,1,5,39,0.0,0.0
catch n' cook a largemouth bass over an open fire catch clean cook freshwater fish,1,15,82,0.14,0.158
about usd  for  piece of of butter naan a type of flatbread and a lamb shish kebab in kuala lumpur,1,20,98,0.0,0.0
savory chicken amp onion gravy over white rice,1,8,46,0.0,0.0
cooking meat in the wild snow eating delicious,1,8,46,0.0,0.346
crispy french fries street food of karachi pakistan please like share amp subscribe to my channel ''afssa foods'' httpsyoutubesjrouwsw thank you ,1,21,145,0.0,0.358
 plates in  pakistani chana chaat street food,1,7,45,0.0,0.0
better than takeout   easy and cheap egg drop soup in  ways,1,11,59,0.132,0.365
and you thought peanut butter amp jelly was cheap,1,9,49,0.0,0.0
how to make chicken spring roll and samosa full recipe  street food of pakistan,1,14,79,0.0,0.0
my mom makes the best kimbap in korea,1,8,37,0.0,0.375
x post from rcooking how to cook a meal out of anything in your kitchen,1,15,71,0.0,0.0
pasta with chicken vegetables and curry sauce,1,7,45,0.0,0.0
pan de muerto bread of the dead,1,7,31,0.417,0.0
spicy chicken liver masala recipe,1,5,33,0.0,0.0
chana chaat  street food of hyderabad  chana chaat recipe  papri chaat,1,11,70,0.0,0.0
cheap pinto bean and cheese burritos about  cents per burrito,1,10,61,0.0,0.0
tasty maggi masala noodles  light on budget,1,7,43,0.0,0.0
muffins with chocolate chips i fill with nutella but this is optional muffins de vainilla con chips de chocolate ,1,19,113,0.0,0.0
how to make spaghetti aglio e olio,1,7,34,0.0,0.0
cheap amp easy  step dessert recipe   lip smacking malai  paneer ladoo ,1,11,71,0.0,0.225
easy halloween korean recipe hobakjuk pumpkin soup,1,7,50,0.0,0.326
quick and easy potato and egg butter toast sandwich,1,9,51,0.0,0.266
 korean side dishes,1,3,19,0.0,0.0
quick and easy vegetable fried rice,1,6,35,0.0,0.367
