title,subreddit,word_count,char_count,neg_sen,pos_sen
super easy amp delicious low carb wraps made with basic ingredients yummy,1,12,73,0.091,0.604
mixed gravy manchurian pasta,1,4,28,0.0,0.0
the ultimate mediterranean nachos,1,4,33,0.0,0.0
these only cost ampwrapand they tasted just like what you get at delis,1,13,70,0.0,0.172
better than the box homemade cheeseburger macaroni hamburger helper,1,9,67,0.0,0.431
how to make pumpkin pasta   jak zrobi makaron z dyni,1,10,52,0.0,0.0
easy bulgogi recipe,1,3,19,0.0,0.592
miniature cooking spaghetti arrabiata   ,1,4,40,0.0,0.0
indian pancake  thosai masala  masala dosa or masale dose,1,9,57,0.0,0.0
tasty egg masala recipe ,1,4,24,0.0,0.0
soft chewy peanut butter cookies  ingredients cost  each,1,8,56,0.0,0.0
chicken malai curry  chicken with coconut milk curry  authentic indian cooking,1,11,78,0.0,0.0
people are crazy for black chickpeas  kala chana,1,8,48,0.255,0.0
easy homemade chicken biryani,1,4,29,0.0,0.492
idli dosa batter recipe for soft idli amp crispy dosa ,1,10,54,0.0,0.0
how to make hummus besides main ingredients i also added cashew nuts as delicious twist como hacer hummus,1,18,105,0.11,0.176
omaj potage an ethnic potage of east azerbaijan,1,8,47,0.0,0.0
easy korean rice cake basically delicious playdoh,1,7,49,0.0,0.569
how to make autumn squash soup   jak zrobi jesienn zup dyniow,1,11,61,0.0,0.0
chicken dosa  madurai kari dosai  chicken masala dosa recipe ,1,9,61,0.0,0.0
soya chunks curry  high protein food  cheap and delicious ,1,9,58,0.0,0.316
paratha  aloo anda cheese paratha  street food of karachi pakistan,1,10,66,0.0,0.0
sohan,1,1,5,0.0,0.0
spicy spanish tuna cakes with garlic yogurt aioli,1,8,49,0.0,0.0
potato amp rice cutlets with leftover rice cheap and easy to make recipe,1,13,72,0.0,0.195
super chewy spicy fried fish ball at chatuchak market,1,9,53,0.0,0.328
mexican style red enchiladas enchiladas rojas estilo mexicano,1,8,61,0.0,0.0
shredded chicken masala  pichupotta chicken recipe ,1,6,51,0.0,0.0
shishandaz gilani,1,2,17,0.0,0.0
i believe this is sometimes called hoosier hash,1,8,47,0.0,0.0
baghla ghatagh stew,1,3,19,0.0,0.0
 in   mashed potatoes  cheese  egg scrambled  only ,1,7,51,0.0,0.0
kashmiri dum aloo  baby potato curry  indian vegetarian recipe,1,9,62,0.0,0.0
rhubarb syrup healthy beverage,1,4,30,0.0,0.474
chicken marsala over white rice,1,5,31,0.0,0.0
how to make hungarian langosz   jak zrobi wgierski langosz,1,9,58,0.0,0.0
breakfast food   fluffy pancake rolls amp butterfly dough fritters,1,9,66,0.0,0.0
korean pork bbq recipe,1,4,22,0.0,0.0
spicy red chilli  garlic chutney recipe for idli dosa ,1,9,54,0.0,0.0
vegetable leftover rice  quick and tasty recipe,1,7,47,0.0,0.0
beef satay recipe sate maraggi,1,5,30,0.0,0.0
quick and tasty masala chilla  spicy vegetable pancake,1,8,54,0.0,0.0
a berliners guide to dner kebab berlins  budget street food,1,10,59,0.0,0.0
bangkok bbq manual machine pressed cuttlefish,1,6,45,0.0,0.0
fried chicken with extremely spicy chilli paste sambal sambal is made entirely with birds eye chilli,1,16,100,0.0,0.0
quick and easy breakfast poha  flattened rice  chirer pulao recipe,1,10,66,0.0,0.244
 asia food tupat tahu magelang english recipe,1,7,45,0.0,0.0
chapathi kurma recipe  white kurma  coconut curry  veg kuruma recipe ,1,10,69,0.0,0.0
spanish empanadas with roasted peppers amp goat cheese,1,8,54,0.0,0.0
how to make chicken amp tomato pasta   jak zrobi makaron z kurczakiem i p,1,14,73,0.0,0.0
aloor dum bengali recipe   spicy mini potato curry   dum aloo   authentic recipe,1,12,80,0.0,0.0
chewy purple sweet potato balls    thailand street food,1,8,55,0.0,0.3
 minute raita recipe  mixed vegetable raita  yogurt salad ,1,8,58,0.0,0.0
homemade paneercheese that doesn't melt super cheap amp easy only  ingredients,1,11,78,0.209,0.193
homemade easiest potato fry recipe,1,5,34,0.0,0.412
vietnamese pancake made from rice flour crepas crujientes estilo vietnam,1,10,72,0.0,0.0
matar paneer recipe  cottage cheese and green peas recipe,1,9,57,0.0,0.0
gola kabab   seekh kabab   beef boti more then  kilo beef kabab made,1,12,68,0.0,0.0
cheap and easy russian gravy beef goulash,1,7,41,0.0,0.326
chicken karahi food street pakistan karachi  half kg karahi price is ,1,11,69,0.0,0.0
best and tasty street food in karachi pakistan is chana chaat or papri chaat,1,14,76,0.0,0.244
how to make plum amp almond cake   jak zrobi ciasto liwkowe z migdaami,1,13,70,0.0,0.0
popular singapore street dessert,1,4,32,0.0,0.483
stir fry rice noodles  singapore style noodles  easy to cook delicious noodles,1,12,78,0.0,0.398
homemade easy french toast recipe  how to make a perfect french toast breakfast,1,13,79,0.0,0.398
falafel with yogurt sauce receta de falafel,1,7,43,0.0,0.0
delicious mutton gravy indian bengali delicacy,1,6,46,0.0,0.425
stuffed mushrooms with spanish romesco sauce,1,6,44,0.0,0.0
oh my,1,2,5,0.0,0.0
mini tart filled with chocolatecheese and lemon we are using cookies and walnuts as crustcupcakes de pay de limon y chocolate blanco,1,22,132,0.065,0.0
easy quick and simple pasta,1,5,27,0.0,0.42
 cheap meals in toronto,1,4,23,0.0,0.0
anda paratha  paratha at street food of karachi pakistan part ,1,10,62,0.0,0.0
mexican style horchata with melon balls and chopped walnuts for extra flavor horchata de arroz,1,15,94,0.0,0.0
special egg burger   price   per burger,1,6,39,0.0,0.351
my favorite food as a kid the simple elegant bologna and mustard sandwich i still eat them theyre still just as good and adding other things ruins it,1,28,149,0.086,0.265
refreshing roast beef coleslaw roll,1,5,35,0.0,0.0
raspberries filo rolls rollitos de frambuesa con queso,1,8,54,0.0,0.0
basa onion fish curry  authentic bengali recipe,1,7,47,0.0,0.0
malaysian preferred choice for lunch nasi campur,1,7,48,0.0,0.0
by adding cinnamon and sugar to the surface of your pancakes you can caramelize the sugar directly onto the surface making for a delicious crunchy treat,1,26,152,0.0,0.218
super crispy chicken fingers tiras de pollo crujientes,1,8,54,0.0,0.358
bread upma   easy to make homemade breakfast recipe,1,8,51,0.0,0.293
russian gravy beef goulash made easy,1,6,36,0.0,0.367
how to make potato pancakes   jak zrobi placki ziemniaczane z cukini i,1,12,70,0.0,0.0
coconut bars with chocolateorhmbounty chocolate bar barritas de coco y chocolate,1,11,80,0.0,0.0
x post thai red curry cheaplazydamn good,1,7,40,0.0,0.367
fast breakfast meal   grilled sausage cheese burger bun with shaved ice chendol drink,1,13,85,0.0,0.0
mango lassi   mango yogurt smoothie   the refreshing summer drink to beat the heat,1,13,82,0.0,0.0
how to make delicious milk rolls   jak zrobi przepyszne bueczki mleczne,1,11,71,0.0,0.27
cheesy chicken reshmi kebab in a pan   authentic recipe   easy home cooking,1,12,75,0.0,0.225
simple pie with spinach and cheese using filo pastry sheets pay de queso con espinacas,1,15,86,0.091,0.0
how to make shakshuka   jak zrobi szakszuk,1,7,42,0.0,0.0
aloo paratha   potato stuffed bread   how to cook   authentic indian cooking,1,11,76,0.0,0.0
famous japanese stuffed pancake   obanyaki,1,5,42,0.0,0.0
microwave steamed shrimp in a bowl   easy home cooking   authentic indian recipe,1,12,80,0.0,0.225
cheesy garlic bread supreme   cheap and quick home made pizza bites ,1,11,68,0.0,0.265
eating at  years old kopitiam coffee shop,1,7,41,0.0,0.0
chicken cheese tikka   easy cooking,1,5,35,0.0,0.42
butter masala dosa chicken tikka boti sav puri pani puri shawarma at thaliland,1,13,78,0.0,0.0
how to make chinese style fries   jak zrobi frytki po chisku,1,11,60,0.265,0.0
artichoke hearts with spicy tomato sauce   cheap to make and loaded with flavor,1,13,79,0.0,0.0
tasty thai roti banana and egg,1,6,30,0.0,0.0
egg  chilli sandwich  bun kabab  just ,1,6,38,0.0,0.0
al rehman biryani   per plate chicken ,1,6,38,0.0,0.0
quick and delicious fig butter burger,1,6,37,0.0,0.425
total bill was  for six of us but we had to queue and hour for this food in penang malaysia,1,20,91,0.0,0.0
traditional way muri making process by village women,1,8,52,0.0,0.0
puffed rice vs ragi murukku awesome evening snacks,1,8,50,0.0,0.369
wow so simple and cheap penne pasta recipe,1,8,42,0.0,0.352
pakistan's famous street food bun kabab,1,6,39,0.0,0.0
upgrade your noodle dishes with real pork bone broth organic pork bones about  lb,1,14,81,0.0,0.0
green fish curry by russian chef look is not everything but taste is,1,13,68,0.0,0.0
pan seared tuna steaks with spanish olives amp herbs,1,9,52,0.0,0.0
ridiculously simple spicy chicken gravy,1,5,39,0.375,0.0
traditional fish head curry,1,4,27,0.0,0.0
ridge gourd rice with potato frywho like variety rice easy  simple amp healthy,1,13,78,0.0,0.448
low budget red beans and rice   serving,1,7,39,0.259,0.0
russian donuts  min donuts recipe ponchiki,1,6,42,0.0,0.0
potatoaloo patra indian snack recipe,1,5,36,0.0,0.0
korean seaweed soup and egg fried rice   quick and easy lunch,1,11,61,0.0,0.225
how to make rice flour roti village style,1,8,41,0.0,0.0
pickled eggs make a great snack and are easy to make,1,11,52,0.0,0.467
ohso easyshrimp curry or malaikari,1,5,34,0.0,0.0
next time you grill or bbq use the residual charcoal heat to make something for another day finished grilling some th of july nathan's dogs now cover for a couple hours for roasted tomatillo salsa for later this week,1,39,216,0.0,0.0
cooking chicken curry recipe village style by my mother,1,9,55,0.0,0.0
easy shrimp salad sencillisima ensalada de camaron,1,7,50,0.0,0.326
oh so yummy  russian dessert sherbet and less ingredients plus cheap in cost,1,13,76,0.0,0.235
japanese pork belly ramen   quick easy amp under ,1,8,49,0.0,0.293
how to open coconut by  years old village kid,1,9,45,0.0,0.0
instant  cheap amp easy snacks with more healthy and yummy tasty,1,11,64,0.0,0.544
cheap ingredients but full of health benefits simple lentil stew,1,10,64,0.0,0.274
don't need to go to kfc anymore cheaply made kfc style popcorn chicken,1,13,70,0.0,0.0
cheap and quick fish curry recipe,1,6,33,0.0,0.0
sticky rice and coconut milk cooked inside bamboo,1,8,49,0.0,0.0
guacamole with chickpeas and oven baked tortilla chips   guacamole con garbanzo y totopos al horno,1,15,98,0.0,0.0
time saving and easy fish finger fish popcorn recipe,1,9,52,0.0,0.266
tasty chicken maharani without masala power,1,6,43,0.0,0.0
paratha roll  kabab paratha roll   street food of karachi pakistan,1,10,66,0.0,0.0
fish fillets wrapped in banana leaf or aluminum foil cooked on stove and easy to do also perfect for camping to cook on barbecue  pescado en hoja de platano,1,29,156,0.0,0.196
instant coconut fry homemade,1,4,28,0.0,0.0
luqman samosa house  muslim street food of karachi pakistan  ramadan special,1,11,76,0.0,0.213
skillet summer squash,1,3,21,0.0,0.0
easy to make spicy garlic mushrooms,1,6,35,0.0,0.367
enchiladas with chileajo mole a traditional mexicanoaxaca dish,1,8,62,0.0,0.0
i had this spanish mackerel in seoul and it was amazing,1,11,55,0.0,0.297
stir fried pad thai chicken noodles  fried rice noodle with chicken,1,11,67,0.0,0.0
protein milk shake   full loaded of dry fruits,1,8,46,0.195,0.0
cheap high nutrient food,1,4,24,0.0,0.0
creamy cheesy and crunchy angel hair pasta,1,7,42,0.0,0.0
super simple tomato sauce pasta,1,5,31,0.0,0.494
how to make pizza without an oven   homemade stove top pizza   inexpensive and easy,1,14,83,0.0,0.281
wholesome beef and veggie porridge for under ,1,7,45,0.0,0.0
street food roti kirai  roti jala net crepes,1,8,44,0.0,0.0
amazingly tasty handmade pan fried vegetable buns,1,7,49,0.0,0.0
oven roasted baby potatoes with sea salt amp rosemary,1,9,53,0.0,0.0
tarbooz ka sharbat  watermelon juice  street food of karachi pakistan,1,10,69,0.0,0.0
healthy cauliflower paella recipe under ,1,5,40,0.0,0.403
chicken shashlik with basil,1,4,27,0.0,0.0
easy penne pasta with tuna amp tomato sauce,1,8,43,0.0,0.293
mexican tortilla soup sopa de tortilla mexicana o sopa azteca,1,10,61,0.0,0.0
fried chicken with honey,1,4,24,0.0,0.0
cold radish soup,1,3,16,0.0,0.0
fried cabbage sausage and onions about  per serving and tasty,1,10,61,0.0,0.0
spanish churros with homemade chocolate sauce,1,6,45,0.0,0.0
a simple and cheap baked chicken and rice dish,1,9,46,0.0,0.0
easy to make lava cake pastel lava,1,7,34,0.0,0.326
charro beans a meal in a bowl with instant pot and crockpot directions,1,13,70,0.0,0.0
mini kibinas from layered dough,1,5,31,0.0,0.0
diagonally cut sandwiches taste better,1,5,38,0.263,0.362
authentic and easy refried beans in your crockpot instant pot or slow cooker,1,13,76,0.0,0.195
split this monster burrito for a massive  chipotle burrito,1,9,58,0.0,0.0
shermaal roti sweet flatbread  is most eatable flatbread in pakistan,1,10,68,0.0,0.25
penn station diy philly cheesesteaks,1,5,36,0.0,0.0
gluten free almond cookies with  ingredients  galletas de almendra con  ingredientes y sin gluten,1,14,97,0.201,0.184
budget beef burritos   novice aussie,1,5,36,0.0,0.0
hey rcheapmeals i'm eating a can of cranberry sauce with berries and have a second can the included recipe wants jello which i don't have and sour cream which i don't like how can i spice up my dinner,1,39,200,0.06,0.0
simple amp delicious oatmeal,1,4,28,0.0,0.552
tilapia is an easy affordable and healthy fish this one pan meal is healthy and easy on the budget,1,19,98,0.0,0.427
super cheap game day chili  feeds  people,1,7,41,0.0,0.394
homemade roasted tomato and garlic soup,1,6,39,0.0,0.0
puff pastry appetizer  hojaldres saladitos volovanes,1,6,52,0.0,0.0
uncommon cow intestine cooking at night village style food cooking by my mother,1,13,79,0.0,0.0
spicy chicken quarters,1,3,22,0.0,0.0
lunch time,1,2,10,0.0,0.0
i'm on the road a lot and need to save money rather than eating out what would some good work meals be that dont need to be refrigerated or heated up,1,31,149,0.0,0.179
spicy spanish garlic shrimp   gambas al pil pil,1,8,47,0.0,0.0
chicken shashlik from the oven,1,5,30,0.0,0.0
easy to make tasty baked garlic chicken wings  full recipe,1,10,58,0.0,0.244
chicken steaks,1,2,14,0.0,0.0
oven roasted chickpeas sweet or spicy,1,6,37,0.0,0.375
skewered chicken kebabs part  the kebabs themselves,1,7,51,0.0,0.0
crepe with salmon,1,3,17,0.0,0.0
chicken with chickpeas,1,3,22,0.0,0.0
coconut barfi   not so traditional,1,5,34,0.0,0.0
authentic spanish horchata   horchata de chufa,1,6,46,0.0,0.0
mutton kosha recipe slow cooked mutton curry with english subtitles,1,10,67,0.0,0.0
never dismiss the classics blt with fresh mozzarella  total because clearance is life,1,13,85,0.0,0.161
chicken with pineapples and celery,1,5,34,0.0,0.0
one pot marsala pasta frugal easy and fast,1,8,42,0.0,0.293
eat the rainbow  rainbow patishapta,1,5,35,0.0,0.0
rainbow cheese toastie,1,3,22,0.0,0.0
tadka dal recipe indian lentils recipe vegetarian one pot easy recipe with english sub,1,14,86,0.0,0.182
vegan savory breakfast,1,3,22,0.0,0.0
prawnshrimp curry  indian spicy prawn curry recipe w english sub,1,10,64,0.0,0.0
simple veg maggi recipe for breakfast,1,6,37,0.0,0.0
lace pancake stuffed with pulled mutton,1,6,39,0.0,0.0
aloo paratha   no stuffing easy recipe  indian flat bread with potato filling recipe w english sub,1,16,98,0.122,0.16
paneer curry with coconut milk recipe  indian cottage cheese curry recipe  w english sub,1,14,88,0.0,0.0
super easy cheap soda bread recipe in comments,1,8,46,0.0,0.531
squid salad,1,2,11,0.0,0.0
grilled sweet potatoes with garlic yogurt aioli,1,7,47,0.0,0.333
coconut porridge,1,2,16,0.0,0.0
buckwheat porridge with mushrooms,1,4,33,0.0,0.0
not potato salad,1,3,16,0.0,0.0
gnocchi with cheese,1,3,19,0.0,0.0
seared tuna steaks with mustard amp thyme,1,7,41,0.0,0.0
french fries potato fries chips with different flavors,1,8,54,0.0,0.0
chicken paratha roll and chicken burger at hot amp arabic food point,1,12,68,0.0,0.0
 food vermicelli and tofu salad ketoprak,1,6,40,0.0,0.0
vegan banana bread recipe,1,4,25,0.0,0.0
big bad blooming onion ,1,4,23,0.538,0.0
tuna stuffed paprikas,1,3,21,0.0,0.0
beef and noodle casserole   italian pasta bake   recipe,1,8,55,0.0,0.0
cowboy casserole  quick and easy meal,1,6,37,0.0,0.367
how to make buffalo chicken pizza as home,1,8,41,0.0,0.0
fruity acai bowl,1,3,16,0.0,0.0
easy cauliflower pizza crust recipe that wont fall apart,1,9,56,0.0,0.266
desi masala pasta amp dry red sauce pasta just under     indian food,1,12,68,0.0,0.0
veggie stuffed portabella mushrooms,1,4,35,0.0,0.0
supermarket price comparison,1,3,28,0.0,0.0
making mac and cheese with cornstarch instead with flour will give a smooth velvety mac and cheese that wont turn into a brick after it cools,1,26,141,0.0,0.0
chicken fake i yani  sides biryani adaptation,1,7,45,0.383,0.0
five minute dollar meal,1,4,23,0.0,0.0
cauliflower wings air fried,1,4,27,0.0,0.0
potato tuna patties recipe,1,4,26,0.0,0.0
chili mac deep dish pizza,1,5,25,0.0,0.0
authentic spanish seafood paella recipe,1,5,39,0.0,0.0
simply ming with jacques pepin   chicken livers two ways   ,1,9,59,0.0,0.0
curried lentil soup sambar,1,4,26,0.0,0.0
toasted mushroom sandwich,1,3,25,0.0,0.0
korean style mussel soup simple amp tasty,1,7,41,0.0,0.0
   vada pav  wada pao  vegetarian fast food  famous indian snack,1,10,64,0.0,0.0
chicken with mushrooms and cream recipe in the comments,1,9,55,0.0,0.0
crunchy breadsticks with sunflower seeds   rosquilletas de pipas,1,8,64,0.0,0.0
kosha mangsho recipe indian recipe slow cooked mutton curry,1,9,59,0.0,0.0
making banana pancake,1,3,21,0.0,0.0
how to cook onion pancake easily,1,6,32,0.0,0.324
 minute seared tuna   star cheapfast recipe ,1,6,44,0.0,0.0
greek yogurt tuna salad,1,4,23,0.0,0.0
 nachos for  people,1,3,19,0.0,0.0
brtchola,1,1,8,0.0,0.0
my favorite super bowl dip,1,5,26,0.0,0.697
home made fish cake recipe,1,5,26,0.0,0.0
easy vegan pesto recipe with kale amp almonds,1,8,45,0.0,0.293
paneer curry with coconut milk  indian cottage cheese curry recipe,1,10,66,0.0,0.0
spanish deviled eggs with tuna   easy tapas recipe,1,8,50,0.226,0.252
recipe the cheapest and easiest chinese dish   tomato egg ,1,9,58,0.0,0.259
sauted vegetables with bacon,1,4,28,0.0,0.0
can't afford fish make vegetarian sushi,1,6,39,0.0,0.0
gond halwa   gajar halwa at dilpasand sweets,1,7,44,0.0,0.348
hot sweet and sour carrot rap,1,6,29,0.0,0.375
stir fried marrow vegetable a low carb vegan food that provides dietary fiber vitaminsiron and calcium,1,16,102,0.13,0.0
extra flaky chinese scallion pancakes recipe ,1,6,45,0.0,0.0
heroic homemade hummus will impress your friends,1,7,48,0.0,0.706
i return triumphant with slop plus an update on year old community project,1,13,74,0.0,0.236
steak smothered sweet potato fries,1,5,34,0.241,0.38
big bad blooming onion air fried,1,6,32,0.412,0.0
chana chaat  papri chaat,1,4,24,0.0,0.0
cold sausage salad with chilli lime mayo,1,7,40,0.0,0.0
recipes and variations for ramen using items you have at home,1,11,61,0.0,0.0
well figuring out if this chicken and vegetables is really cheap and healthy as well,1,15,84,0.0,0.374
 pasta recipes  quick and easy pasta recipes,1,7,44,0.0,0.326
healthy quinoa tacos for the new year,1,7,37,0.0,0.31
cheap after xmas stilton cheesy puffs,1,6,37,0.0,0.0
cheap winter produce,1,3,20,0.0,0.0
how to make sheermaal roti in simple steps,1,8,42,0.0,0.0
making simple recipe pukis cake,1,5,31,0.0,0.0
greek style lentil soup fakes recipe saving made delicious and easy,1,11,67,0.161,0.379
greek bean soup recipe fasolada and boiled potatoes greek style,1,10,63,0.0,0.0
looking for recipe ideas,1,4,24,0.0,0.0
sausage egg muffins,1,3,19,0.0,0.0
not grandma's oatmeal,1,3,21,0.0,0.0
cheap amp easy family meals  healthy amp easy recipes,1,9,53,0.0,0.586
easy amp healthy dinner ideas  vegan recipes ,1,7,45,0.0,0.528
crispiest fish fingers using basa fish,1,6,38,0.0,0.0
potato stuffed paratha a rich breakfast suggession,1,7,50,0.0,0.419
three nut veg korma,1,4,19,0.0,0.0
make the most popular chinese dish with ,1,7,40,0.0,0.34
a toast sandwich,1,3,16,0.0,0.0
how to cook perfect fluffy scrambled eggs,1,7,41,0.0,0.381
mod post before you post asking questions for recipes please use our search bar trust usyour question has been asked before,0,21,123,0.0,0.228
cucumber salad,0,2,14,0.0,0.0
kala chana cheap and very healthy option,0,7,40,0.0,0.333
you should try this snack,0,5,25,0.0,0.0
watermelon and whole fruit popsicle,0,5,35,0.0,0.0
what to do this leftover celery,0,6,31,0.0,0.0
making a cheaper meal replacement,0,5,33,0.0,0.0
i just found out how simple 'casseroles' are and made like  this week,0,13,69,0.0,0.185
beat the heat you can save some dollars by making your own iced tea,0,14,67,0.0,0.198
chocolate peanut butter mug cake,0,5,32,0.0,0.0
give me your best canned salmon recipes,0,7,39,0.0,0.412
about to take a trip to h mart,0,8,30,0.0,0.0
microwavable rice bags yay or nay,0,6,33,0.0,0.405
working at a camp   no access to fridgefreezer,0,8,46,0.268,0.0
making the switch from all purpose white flour to whole grain alternatives and i would love suggestions,0,17,103,0.0,0.219
can anyone help me with a high protein very low effort diet,0,12,59,0.17,0.192
how to make creamy pinto beans like they come in cans without tons of extra ingredients,0,16,87,0.0,0.143
iso cold meals,0,3,14,0.0,0.0
what are some staples for those who are gluten and dairy free,0,12,61,0.0,0.231
i got a pressure cooker and haven't used it much what are cheap and healthy ingredients i can get that will go for any dinner,0,25,125,0.088,0.108
good cheap bento box food,0,5,25,0.0,0.42
is gnocchi actually better for you than regular pasta,0,9,53,0.0,0.266
sushi no really,0,3,15,0.524,0.0
what is something cheap and healthy i can add to pasta,0,11,54,0.0,0.231
is there anything i'm missing from my diet,0,8,42,0.239,0.0
cheap and healthy dessert ideas,0,5,31,0.0,0.403
mix ins for chicken and rice,0,6,28,0.0,0.0
recipestips to avoid too much cleaning,0,6,38,0.306,0.0
is it really more cost effective to make your own bread,0,11,55,0.0,0.267
what're some good no cooking required foods like sandwiches to pack for a multiple day roadtrip amp camping trip,0,19,112,0.097,0.239
cheap diy breakfast sandwich,0,4,28,0.0,0.0
cheap vegetarian and easy to make,0,6,33,0.0,0.367
what's the safest way to eat rice and fish everyday,0,10,51,0.0,0.231
how do i get started on a meal schedule,0,9,39,0.0,0.0
how can i turn grits into masa harina,0,8,37,0.0,0.0
easy way to portion up a big bag of frozen vegetables for the week,0,14,66,0.0,0.195
quick corn chowder,0,3,18,0.0,0.0
super cheap healthy fast and easy curried omelettes,0,8,51,0.0,0.655
what are some low carb or carb free products i can buy looking for something that will keep me full in between mealtimes and also something sweet to accompany my morning coffee,0,32,176,0.058,0.173
just found out about frozen grapes how come nobody told me they were so good,0,15,76,0.0,0.211
good and inexpensive grocery stores in chicago,0,7,46,0.0,0.326
good chicken dinners,0,3,20,0.0,0.592
playing around with stirfrys and created something interesting,0,8,62,0.0,0.565
healthy and simple granola muesli recipe i came up with,0,10,55,0.0,0.252
cleaning chicken,0,2,16,0.0,0.0
is microwaving your food healthy,0,5,32,0.0,0.403
need lunchdinnersnack ideas,0,3,27,0.0,0.0
what do i do with cherry tomatoes,0,7,33,0.0,0.0
breakfastevening food,0,2,21,0.0,0.0
is peanut butter an acceptable source of fats,0,8,45,0.0,0.247
i have bags of grapes what do i do with them,0,11,44,0.0,0.0
what to do with napa and cone cabbage,0,8,37,0.0,0.0
some cranberry recipes,0,3,22,0.0,0.0
my two favourite and super cheap fideo recipes,0,8,46,0.0,0.358
looking for some easy recipes,0,5,29,0.0,0.42
feeding  people that eat like ,0,5,30,0.0,0.385
high calorie lunches and snacks,0,5,31,0.0,0.0
are lentils on their own enough okay as your only source of calcium,0,13,67,0.0,0.137
easy lowcountry boil,0,3,20,0.0,0.592
corn tortillas,0,2,14,0.0,0.0
breakthrough over takeout because of a breakup,0,7,46,0.0,0.0
is there anything missing from this extremely cheap and simple diet of mine,0,13,75,0.155,0.0
things that can be prepared a few hours before eating in a sandwich toaster,0,14,75,0.0,0.147
bulking up,0,2,10,0.0,0.0
redoing entire pantry and fridge  need suggestions,0,7,50,0.0,0.0
i have  lbs of kiwi what can i make with it besides smoothies,0,13,61,0.0,0.0
any tips for freezing foods,0,5,27,0.259,0.0
i've got a microwave and a fridgefreezer and i don't like bread or pasta need help with meal ideas,0,19,98,0.112,0.144
can i use a rice cooker in office,0,8,33,0.0,0.0
what kinds of fruits are generated considered low in calories,0,10,61,0.189,0.0
malt o meal is better than oatmeal and no one can convince me otherwise,0,14,71,0.129,0.287
how to subtly en corporate broccoli without actually tasting it blending it into rice,0,14,85,0.0,0.0
easy to clean blender uk,0,5,24,0.0,0.651
i can't keep eating hot dogs i am sick of eggs and chicken i'm looking for some cheap healthy and quick to prepare meals,0,24,120,0.127,0.104
frozen grapes are the perfect cheap and very healthy cold snack alternative to popsicles and ice cream,0,17,102,0.0,0.309
what does your weekly meal plan look like,0,8,41,0.0,0.263
peanut butter uses,0,3,18,0.0,0.0
this sub is fantastic and has given me some good ideas so i shall ask a question or ,0,18,84,0.0,0.317
super easy and filling meal sweet potato kale mushrooms,0,9,55,0.0,0.62
what are some all in one gadgets that are good for college kitchenettes,0,13,71,0.0,0.195
easy cold work lunches,0,4,22,0.0,0.492
about to do groceries under ,0,5,28,0.0,0.0
any actual and literal zero prep dump meals i'm tired of being lied to,0,14,70,0.424,0.0
vegetarian meals  recipes,0,3,25,0.0,0.0
just bought a house and have been eating out and overeating what are some of your favorite few ingredient recipes that dont take too terribly long to prep,0,28,154,0.0,0.192
eating chipotle  days a week for lunch half off,0,9,47,0.0,0.0
looking for wrap replacements,0,4,29,0.0,0.0
gerd friendly recipes please ,0,4,29,0.0,0.733
lunch for those who work from a car,0,8,35,0.0,0.0
